id,juId,content,poetId,poetName,poetryId,poetryName
4107,4228,路入南中，桄榔叶暗蓼花红。,175,欧阳炯,72008,南乡子·路入南中
4108,4229,新叶初冉冉，初蕊新霏霏。,32,谢朓,71533,咏落梅
4109,4230,秋声带叶萧萧落，莫响城头角！,143,董士锡,70787,虞美人·韶华争肯偎人住
4110,4231,败叶填溪水已冰，夕阳犹照短长亭。,188,纳兰性德,71767,浣溪沙·败叶填溪水已冰
4111,4232,惠远祠前晋溪水，翠叶银花清见底。,600,元好问,71668,过晋阳故城书事
4112,4233,桃根桃叶终相守，伴殷勤、双宿鸳鸯。,188,纳兰性德,71613,一丛花·咏并蒂莲
4113,4234,青蒲衔紫茸，长叶复从风。,0,,72453,拔蒲二首
4114,4235,荷叶五寸荷花娇，贴波不碍画船摇；,1729,石涛,72638,荷花
4115,4236,酒市渐闲灯火，正敲窗、乱叶舞纷纷。,605,孔夷,64477,南浦·旅怀
4116,4237,莲香隔浦渡，荷叶满江鲜。,1301,刘孝威,72635,采莲曲·金桨木兰船
4117,4238,手种黄柑二百株，春来新叶遍城隅。,646,柳宗元,18267,柳州城西北隅种柑树
4118,4239,黄叶覆溪桥，荒村唯古木。,646,柳宗元,18295,秋晓行南谷经荒村
4119,4240,东门之杨，其叶牂牂。,0,,138,东门之杨
4120,4241,如何同枝叶，各自有枯荣。,247,李白,7804,树中草
4121,4242,龟游莲叶上，鸟宿芦花里。,247,李白,8374,姑孰十咏
4122,4243,商叶堕干雨，秋衣卧单云。,232,孟郊,19451,秋怀十五首
4123,4244,棘枝风哭酸，桐叶霜颜高。,232,孟郊,19451,秋怀十五首
4124,4245,瘦叶几经雪，淡花应少春。,28,于武陵,32660,赠卖松人
4125,4246,荒戍落黄叶，浩然离故关。,415,温庭筠,31867,送人东游
4126,4247,绿叶渐成阴，下有游人归路。,405,王安石,49099,伤春怨·雨打江南树
4127,4248,西风乱叶溪桥树。秋在黄花羞涩处,317,张榘,61374,青玉案·被檄出郊题陈氏山居
4128,4249,过雨西风，数叶井梧愁舞。,670,吴文英,62258,荔枝香近·七夕
4129,4250,夜来疏雨鸣金井，一叶舞空红浅。,0,,68283,齐天乐·夜来疏雨鸣金井
4130,4251,败垣芳草，空廊落叶，深砌苍苔。,476,徐再思,69777,人月圆·甘露怀古
4131,4252,叶落当归根，云沉久必起。,0,,71601,悯黎咏
4132,4253,重重蕊叶相怜，似青帔艳妆神仙侣。,458,曹勋,71564,夹竹桃花·咏题
4133,4254,疏林红叶，芙蓉将谢，天然妆点秋屏列。,638,薛昂夫,71569,西湖杂咏·秋
4134,4255,叶落根偏固，心虚节更高。,2554,憨山德清,71551,咏竹五首
4135,4256,叶落风不起，山空花自红。,100,陈师道,71499,妾薄命·为曾南丰作
4136,4257,湘西一杯酒，渺渺红叶换。,266,赵蕃,71417,次韵酬吴德夫去秋送行之作
4137,4258,大漠西风急，黄榆凉叶飞。,2428,田锡,71325,塞上曲
4138,4259,久雨寒蝉少，空山落叶深。,0,,71292,山中
4139,4260,君看萧萧只数叶，满堂风雨不胜寒。,73,李东阳,71011,柯敬仲墨竹
4140,4261,庭下如积水空明，水中藻、荇交横，盖竹柏影也。,183,苏轼,71144,记承天寺夜游 / 记承天夜游
4141,4262,何夜无月？何处无竹柏？但少闲人如吾两人者耳。,183,苏轼,71144,记承天寺夜游 / 记承天夜游
4142,4263,竹径通幽处，禅房花木深。,443,常建,6525,题破山寺后禅院
4143,4264,过江千尺浪，入竹万竿斜。,521,李峤,3493,风
4144,4265,苍苍竹林寺，杳杳钟声晚。,104,刘长卿,6606,送灵澈上人
4145,4266,林断山明竹隐墙。乱蝉衰草小池塘。,183,苏轼,49431,鹧鸪天·林断山明竹隐墙
4146,4267,新竹高于旧竹枝，全凭老干为扶持。,573,郑燮,71979,新竹
4147,4268,野竹分青霭，飞泉挂碧峰。,247,李白,8413,访戴天山道士不遇
4148,4269,绿竹半含箨，新梢才出墙。,474,杜甫,11169,严郑公宅同咏竹
4149,4270,绿竹入幽径，青萝拂行衣。,247,李白,8229,下终南山过斛斯山人宿置酒
4150,4271,水绕陂田竹绕篱，榆钱落尽槿花稀。,243,张舜民,70935,村居
4151,4272,竹怜新雨后，山爱夕阳时。,495,钱起,11826,谷口书斋寄杨补阙
4152,4273,松竹翠萝寒，迟日江山暮。,537,曹组,52178,卜算子·兰
4153,4274,孤灯寒照雨，湿竹暗浮烟。,750,司空曙,15477,云阳馆与韩绅宿别
4154,4275,凭阑半日独无言，依旧竹声新月似当年。,269,李煜,47053,虞美人·风回小院庭芜绿
4155,4276,道人庭宇静，苔色连深竹。,646,柳宗元,18215,晨诣超师院读禅经
4156,4277,归来三径重扫，松竹本吾家。,71,叶梦得,51987,水调歌头·秋色渐将晚
4157,4278,片帆西去，一声谁喷霜竹。,217,辛弃疾,57544,念奴娇·登建康赏心亭呈史致道留守
4158,4279,井灶有遗处，桑竹残朽株。,645,陶渊明,71307,归园田居·其四
4159,4280,南山截竹为觱篥，此乐本自龟兹出。,671,李颀,6033,听安万善吹觱篥歌
4160,4281,独写菖蒲竹叶杯，蓬城芳草踏初回。,354,汤显祖,71344,午日处州禁竞渡
4161,4282,孙郎微笑，坐来声喷霜竹。,268,黄庭坚,49867,念奴娇·断虹霁雨
4162,4283,擢擢当轩竹，青青重岁寒。,0,,4864,咏院中丛竹
4163,4284,竹篱茅舍，淡烟衰草孤村。,278,白朴,71436,天净沙·冬
4164,4285,迸箨分苦节，轻筠抱虚心。,646,柳宗元,18323,巽公院五咏·苦竹桥
4165,4286,不是诚斋无月，隔一林修竹。,361,杨万里,56477,好事近·七月十三日夜登万花川谷望月作
4166,4287,南国辛居士，言归旧竹林。,757,孟浩然,7358,都下送辛大之鄂
4167,4288,竹柏皆冻死，况彼无衣民。,665,白居易,21210,村居苦寒
4168,4289,淇澳春云碧，潇湘夜雨寒。,2554,憨山德清,71551,咏竹五首
4169,4290,闻说东风亦多情，被竹外、香留住。,729,史达祖,59868,留春令·咏梅花
4170,4291,蓼岸荻花中，隐映竹篱茅舍。,290,张昪,65080,离亭燕·一带江山如画
4171,4292,凭栏久，黄芦苦竹，拟泛九江船。,164,周邦彦,50967,满庭芳·夏日溧水无想山作
4172,4293,东岩富松竹，岁暮幸同归。,289,王勃,3172,送卢主簿
4173,4294,西风稍急喧窗竹，停又续，腻脸悬双玉。,284,阎选,47344,河传·秋雨
4174,4295,见碧水丹山，黄芦苦竹。,451,宋江,71861,满江红·喜遇重阳
4175,4296,窗前竹叶，凛凛狂风折。,848,张淑芳,68640,满路花·冬
4176,4297,奈南墙冷落，竹烟槐雨。,670,吴文英,62370,惜秋华·七夕前一日送人归盐官
4177,4298,细读离骚还痛饮，饱看修竹何妨肉。,217,辛弃疾,57746,满江红·山居即事
4178,4299,榴叶拥花当北户，竹根抽笋出东墙。,454,汤允绩,72056,浣溪沙·燕垒雏空日正长
4179,4300,青林翠竹，四时俱备。,24,陶弘景,71143,答谢中书书
4180,4301,竹竿有甘苦，我爱抱苦节。,232,孟郊,32014,苦寒吟
4181,4302,野竹交淇水，秋瓜蔓帝邱。,568,司马光,71881,送云卿知卫州
4182,4303,盘馐蒟酱实，歌杂竹枝辞。,568,司马光,71892,送张寺丞觐知富顺监
4183,4304,竹树无声或有声，霏霏漠漠散还凝。,291,杜荀鹤,38086,春日山中对雪有作
4184,4305,掩柴扉，谢他梅竹伴我冷书斋。,239,沈自晋,71447,玉芙蓉·雨窗小咏
4185,4306,润逼琴丝，寒侵枕障，虫网吹黏帘竹。,164,周邦彦,51007,大酺·越调春雨
4186,4307,一丛萱草，几竿修竹，数叶芭蕉。,574,石孝友,58578,眼儿媚·愁云淡淡雨潇潇
4187,4308,华表月明归夜鹤，叹当时、花竹今如此。,670,吴文英,62512,金缕歌·陪履斋先生沧浪看梅
4188,4309,竹疏虚槛静，松密醮坛阴。,688,张泌,47377,女冠子·露花烟草
4189,4311,历冰霜、不变好风姿，温如玉。,1044,陆容,71611,满江红·咏竹
4190,4312,坐荫从容烦暑退，清心恍惚微香触。,1044,陆容,71611,满江红·咏竹
4191,4313,上窗风动竹，月微明。,241,吕渭老,53772,小重山·七夕病中
4192,4314,想翠竹、碧梧风采，旧游何处。,1130,张宁,71919,满江红·题碧梧翠竹送李阳春
4193,4315,野店垂杨步，荒祠苦竹丛。,529,范成大,71807,寒食郊行书事
4194,4316,烟萝翠竹，欠罗袖、为倚天寒日暮。,670,吴文英,62366,绛都春·余往来清华池馆六年赋咏屡矣感昔伤今益不堪怀乃复作此解
4195,4317,玉树犹难伸，压倒千竿竹。,0,,71484,薛宝钗·雪竹
4196,4318,日暮九疑何处？认舜祠丛竹。,666,文廷式,70814,好事近·湘舟有作
4197,4319,修竹畔，疏帘里。歌余尘拂扇，舞罢风掀袂。,280,谢逸,51375,千秋岁·咏夏景
4198,4320,柏府楼台衔倒影，茅茨松竹泻寒声。,706,王守仁,71787,次韵陆佥宪元日春晴
4199,4321,修竹傍林开，乔松倚岩列。,0,,71399,新秋晚眺
4200,4322,不种闲花，池亭畔、几竿修竹。,1044,陆容,71611,满江红·咏竹
4201,4323,淇园春竹美，军宴日椎牛。,568,司马光,71909,送龚章判官之卫州·新及第
4202,4324,松竹含新秋，轩窗有余清。,2415,崔元翰,16548,奉和圣制中元日题奉敬寺
4203,4325,蜡炬风摇帘不下，竹影半墙如画。,277,项鸿祚,70794,清平乐·池上纳凉
4204,4326,先生名利比尘灰，绿竹青松手自栽。,112,王汝舟,71575,咏归堂隐鳞洞
4205,4327,高节志凌云，不敢当滕六。,0,,71484,薛宝钗·雪竹
4206,4328,竹树带飞岚，荇藻俱明丽。,0,,71392,湘江秋晓
4207,4329,种竹淇园远致君，生平孤节负辛勤。,112,王汝舟,71575,咏归堂隐鳞洞
4208,4330,性孤高似柏，阿娇金屋。,1044,陆容,71611,满江红·咏竹
4209,4331,未成林，难望凤来栖，聊医俗。,1044,陆容,71611,满江红·咏竹
4210,4334,象龙唤不应，竹龙起行雨。,406,张孝祥,71776,湖湘以竹车激水粳稻如云书此能仁院壁
4211,4335,团扇不摇风自举，盈盈翠竹，纤纤白苎，不受些儿暑。,21,文征明,70695,青玉案·庭下石榴花乱吐
4212,4337,迟迟钟鼓初长夜，耿耿星河欲曙天。,665,白居易,21744,长恨歌
4213,4338,辛苦遭逢起一经，干戈寥落四周星。,173,文天祥,69147,过零丁洋
4214,4339,星汉灿烂，若出其里。,552,曹操,48005,观沧海
4215,4340,雄州雾列，俊采星驰。,289,王勃,47909,滕王阁序
4216,4341,月明星稀，乌鹊南飞。绕树三匝，何枝可依？,552,曹操,48003,短歌行
4217,4342,迢迢牵牛星，皎皎河汉女。,0,,47873,迢迢牵牛星
4218,4343,星点点，月团团。倒流河汉入杯盘。,328,刘著,72034,鹧鸪天·雪照山城玉指寒
4219,4344,银鞍照白马，飒沓如流星。,247,李白,1744,侠客行
4220,4345,危楼高百尺，手可摘星辰。,247,李白,71217,夜宿山寺
4221,4346,长歌吟松风，曲尽河星稀。,247,李白,8229,下终南山过斛斯山人宿置酒
4222,4347,草木摇杀气，星辰无光彩。,247,李白,7948,经乱离后天恩流夜郎忆旧游书怀赠江夏韦太守良宰
4223,4348,北斗七星高，哥舒夜带刀。,618,西鄙人,42345,哥舒歌
4224,4349,五更鼓角声悲壮，三峡星河影动摇。,474,杜甫,11218,阁夜
4225,4350,塞马一声嘶，残星拂大旗。,188,纳兰性德,71491,菩萨蛮·朔风吹散三更雪
4226,4351,卧看牵牛织女星，月转过梧桐树影。,191,卢挚,71822,沉醉东风·七夕
4227,4352,云拼欲下星斗动，天乐一声肌骨寒。,197,刘禹锡,71345,八月十五夜桃源玩月
4228,4353,接汉疑星落，依楼似月悬。,744,卢照邻,2523,十五夜观灯
4229,4354,耿斜河、疏星淡月，断云微度。,120,张元干,53503,贺新郎·送胡邦衡待制赴新州
4230,4355,残星几点雁横塞，长笛一声人倚楼。,10,赵嘏,29749,长安晚秋 / 秋望 / 秋夕
4231,4356,灯火万家城四畔，星河一道水中央。,665,白居易,22575,江楼夕望招客
4232,4357,双星何事今宵会，遗我庭前月一钩。,0,,71366,七夕二首·其一
4233,4358,一声已动物皆静，四座无言星欲稀。,671,李颀,6016,琴歌
4234,4359,晓月过残垒，繁星宿故关。,750,司空曙,15468,贼平后送人北归
4235,4360,逢流星兮问路，顾我指兮从左。,876,王逸,72414,九思
4236,4361,曲终漏尽严具陈，月没星稀天下旦。,0,,72463,鸡鸣歌
4237,4362,乌鹊倦栖，鱼龙惊起，星斗挂垂杨。,244,陈亮,58964,一丛花·溪堂玩月作
4238,4363,梦入蓝桥，几点疏星映朱户。,670,吴文英,62258,荔枝香近·七夕
4239,4364,更深黄月落，夜久靥星稀。,1389,任希古,2614,和长孙秘监七夕
4240,4365,此夜星繁河正白，人传织女牵牛客。,494,沈佺期,4670,七夕曝衣篇
4241,4366,南国有佳人，容华若桃李。,322,曹植,70889,杂诗七首·其四
4242,4367,孤灯不明思欲绝，卷帷望月空长叹。美人如花隔云端！,247,李白,7727,长相思·其一
4243,4368,易求无价宝，难得有情郎。,114,鱼玄机,42920,赠邻女 / 寄李亿员外
4244,4369,竹喧归浣女，莲动下渔舟。,515,王维,5636,山居秋暝
4245,4370,苦恨年年压金线，为他人作嫁衣裳。,614,秦韬玉,36250,贫女
4246,4371,以色事他人，能得几时好。,247,李白,1682,妾薄命
4247,4372,七夕今宵看碧霄，牵牛织女渡河桥。,731,林杰,24482,乞巧
4248,4373,宁不知倾城与倾国。佳人难再得。,75,李延年,47938,李延年歌
4249,4374,红颜未老恩先断，斜倚薰笼坐到明。,665,白居易,22409,后宫词
4250,4375,东飞伯劳西飞燕，黄姑织女时相见。,884,萧衍,48114,东飞伯劳歌
4251,4376,吏呼一何怒，妇啼一何苦。,474,杜甫,10449,石壕吏
4252,4377,遥怜小儿女，未解忆长安。,474,杜甫,10832,月夜
4253,4378,墙外行人，墙里佳人笑。,183,苏轼,49481,蝶恋花·春景
4254,4379,神女生涯原是梦，小姑居处本无郎。,204,李商隐,28900,无题·重帏深下莫愁堂
4255,4380,美人自刎乌江岸，战火曾烧赤壁山，将军空老玉门关。,394,张可久,71669,卖花声·怀古
4256,4381,老翁逾墙走，老妇出门看。,474,杜甫,10449,石壕吏
4257,4382,波澜誓不起，妾心古井水。,232,孟郊,19317,烈女操
4258,4383,朱弦已为佳人绝，青眼聊因美酒横。,268,黄庭坚,69107,登快阁
4259,4384,妾家高楼连苑起，良人执戟明光里。,390,张籍,19761,节妇吟·寄东平李司空师道
4260,4385,啼时惊妾梦，不得到辽西。,423,金昌绪,41885,春怨 / 伊州歌
4261,4386,妇姑相唤浴蚕去，闲看中庭栀子花。,482,王建,16108,雨过山村
4262,4387,会稽愚妇轻买臣，余亦辞家西入秦。,247,李白,8092,南陵别儿童入京
4263,4388,谢公最小偏怜女，自嫁黔娄百事乖。,18,元稹,20686,遣悲怀三首·其一
4264,4389,嫁得瞿塘贾，朝朝误妾期。,484,李益,1231,江南曲
4265,4390,谁爱风流高格调，共怜时世俭梳妆。,614,秦韬玉,36250,贫女
4266,4391,游子乍闻征袖湿，佳人才唱翠眉低。,434,郑谷,36736,鹧鸪
4267,4392,巧笑东邻女伴，采桑径里逢迎。,432,晏殊,48718,破阵子·春景
4268,4393,君为女萝草，妾作菟丝花。,247,李白,7872,古意
4269,4394,彩线轻缠红玉臂，小符斜挂绿云鬟。佳人相见一千年。,183,苏轼,49607,浣溪沙·端午
4270,4395,承恩不在貌，教妾若为容。,291,杜荀鹤,46914,春宫怨
4271,4396,东家头白双女儿，为解挑纹嫁不得。,18,元稹,21053,织妇词
4272,4397,卢家少妇郁金堂，海燕双栖玳瑁梁。,494,沈佺期,4745,古意呈补阙乔知之 / 独不见
4273,4398,人家见生男女好，不知男女催人老。,482,王建,15763,短歌行
4274,4399,朝为越溪女，暮作吴宫妃。,515,王维,5528,西施咏
4275,4400,遍身罗绮者，不是养蚕人。,487,张俞,70923,蚕妇
4276,4401,依旧桃花面，频低柳叶眉。,622,韦庄,71061,女冠子·昨夜夜半
4277,4402,昨日春如，十三女儿学绣。,217,辛弃疾,57788,粉蝶儿·和赵晋臣敷文赋落花
4278,4403,香脸半开娇旖旎。当庭际。玉人浴出新妆洗。,536,李清照,52788,渔家傲·雪里已知春信至
4279,4404,堂前扑枣任西邻，无食无儿一妇人。,474,杜甫,11457,又呈吴郎
4280,4405,女子今有行，大江溯轻舟。,564,韦应物,8750,送杨氏女
4281,4406,年年越溪女，相忆采芙蓉。,291,杜荀鹤,46914,春宫怨
4282,4407,团扇，团扇，美人病来遮面。,482,王建,71050,宫中调笑·团扇
4283,4408,阿婆还似初笄女，头未梳成不许看。,676,袁枚,69369,遣兴
4284,4409,辽东小妇年十五，惯弹琵琶解歌舞。,671,李颀,6038,古意
4285,4410,汉帝重阿娇，贮之黄金屋。,247,李白,1682,妾薄命
4286,4411,汉女输橦布，巴人讼芋田。,515,王维,5611,送梓州李使君
4287,4412,西施越溪女，出自苎萝山。,247,李白,8353,西施 / 咏苎萝山
4288,4413,夫因兵死守蓬茅，麻苎衣衫鬓发焦。,291,杜荀鹤,38054,山中寡妇 / 时世行
4289,4414,应倾谢女珠玑箧，尽写檀郎锦绣篇。,135,罗隐,35682,七夕
4290,4415,数亩荒园留我住，半瓶浊酒待君温。,183,苏轼,71923,正月二十日往岐亭郡人潘古郭三人送余于女王城东禅庄院
4291,4416,何时诏此金钱会，暂醉佳人锦瑟旁。,474,杜甫,10855,曲江对雨
4292,4417,易挑锦妇机中字。难得玉人心下事。,106,刘克庄,61207,玉楼春·戏林推
4293,4418,虽然不如延年妹，亦是当时绝世人。,247,李白,7752,中山孺子妾歌
4294,4419,低头羞见人，双手结裙带。,144,毛铉,71008,幼女词
4295,4420,淡黄杨柳暗栖鸦。玉人和月摘梅花。,399,贺铸,50670,减字浣溪沙·楼角初销一缕霞
4296,4421,下床着新衣，初学小姑拜。,144,毛铉,71008,幼女词
4297,4422,素娥惟与月，青女不饶霜。,204,李商隐,28732,十一月中旬至扶风界见梅花
4298,4423,新样靓妆，艳溢香融，羞杀蕊珠宫女。,428,赵佶,52680,燕山亭·北行见杏花
4299,4424,红粉当垆弱柳垂，金花腊酒解酴醿。,60,贾至,11674,春思二首
4300,4425,美人梳洗时，满头间珠翠。,549,郑遨,45647,富贵曲
4301,4426,粉色全无饥色加，岂知人世有荣华。,291,杜荀鹤,38163,蚕妇
4302,4427,忆共锦衾无半缝，郎似桐花，妾似桐花凤。,599,王士祯,70746,蝶恋花·和漱玉词
4303,4428,佳人重劝千长寿。柏叶椒花芬翠袖。,710,毛滂,51496,玉楼春·己卯岁元日
4304,4429,世态便如翻覆雨，妾身元是分明月。,173,文天祥,68387,满江红·和王夫人满江红韵以庶几後山妾薄命之意
4305,4430,望断行云无觅处，梦回明月生南浦。,167,司马槱,72020,黄金缕·妾本钱塘江上住
4306,4431,女萝发馨香，菟丝断人肠。,247,李白,7872,古意
4307,4432,小男供饵妇搓丝，溢榼香醪倒接罹。,824,李郢,32432,南池
4308,4433,不信楼头杨柳月，玉人歌舞未曾归。,497,谢枋得,71287,蚕妇吟
4309,4434,兰帐玉人睡觉，怪春衣、雪沾琼缀。,245,章楶,65200,水龙吟·燕忙莺懒芳残
4310,4435,中山孺子倚新妆，郑女燕姬独擅场。,146,李梦阳,71353,汴京元夕
4311,4436,明妃一朝西入胡，胡中美女多羞死。,247,李白,7748,于阗采花
4312,4437,不信妾断肠，归来看取明镜前。,247,李白,70877,长相思·其二
4313,4438,桑柘外秋千女儿，髻双鸦斜插花枝。,191,卢挚,71809,蟾宫曲·寒食新野道中
4314,4439,一夜娇啼缘底事，为嫌衣少缕金华。,622,韦庄,38518,与小女
4315,4440,西门秦氏女，秀色如琼花。,247,李白,7789,秦女休行
4316,4441,今日汉宫人，明朝胡地妾。,247,李白,7751,王昭君二首
4317,4442,鲁女东窗下，海榴世所稀。,247,李白,8444,咏邻女东窗海石榴
4318,4443,佳人彩云里，欲赠隔远天。,247,李白,71278,折荷有赠
4319,4444,水晶帘不下，云母屏开，冷浸佳人淡脂粉。,643,晁补之,50870,洞仙歌·泗州中秋作
4320,4445,美女渭桥东，春还事蚕作。,247,李白,7799,陌上桑
4321,4446,愿学秋胡妇，贞心比古松。,247,李白,1557,湖边采莲妇
4322,4447,谁家女儿对门居，开颜发艳照里闾。,884,萧衍,48114,东飞伯劳歌
4323,4448,当垆秦女，十五语如弦。,399,贺铸,50488,行路难·缚虎手
4324,4449,佳人应怪我，别后寡信轻诺。,535,柳永,48211,尾犯·夜雨滴空阶
4325,4450,愿妾身为红菡萏。年年生在秋江上。,561,欧阳修,48903,渔家傲·近日门前溪水涨
4326,4451,山僧过岭看茶老，村女当垆煮酒香。,177,祝允明,71386,首夏山中行吟
4327,4453,游女昔解佩，传闻于此山。,757,孟浩然,7282,万山潭作
4328,4454,岸边两两三三，浣沙游女。,535,柳永,48331,夜半乐·冻云黯淡天气
4329,4455,小姑织白纻，未解将人语。,247,李白,1557,湖边采莲妇
4330,4456,水上游人沙上女，回顾，笑指芭蕉林里住。,175,欧阳炯,72007,南乡子·画舸停桡
4331,4457,思妇高楼上，当窗应未眠。,386,徐陵,48149,关山月
4332,4458,魏都接燕赵，美女夸芙蓉。,247,李白,8071,魏郡别苏明府因北游
4333,4459,戚姬髡发入舂市，万古共悲辛。,247,李白,7752,中山孺子妾歌
4334,4460,楼头小妇鸣筝坐，遥见飞尘入建章。,437,王昌龄,6440,青楼曲二首
4335,4461,天公见玉女，大笑亿千场。,247,李白,7796,短歌行
4336,4462,燕支落汉家，妇女无华色。,247,李白,7782,塞上曲
4337,4464,骚屑西风弄晚寒，翠袖倚阑干。,188,纳兰性德,71610,眼儿媚·咏红姑娘
4338,4465,采莲时，小娘红粉对寒浪。,415,温庭筠,71766,荷叶杯·镜水夜来秋月
4339,4466,天子居未央，妾侍卷衣裳。,247,李白,7790,秦女卷衣
4340,4468,采桑秦氏女，织锦窦家妻。,565,薛道衡,48168,昔昔盐
4341,4469,潭潭大度如卧虎，边头耕桑长儿女。,268,黄庭坚,71884,送范德孺知庆州
4342,4470,欢宴良宵好月，佳人修竹清风。,670,吴文英,62347,风入松·麓翁园堂宴客
4343,4471,女儿年几十五六，窈窕无双颜如玉。,884,萧衍,48114,东飞伯劳歌
4344,4472,起来无语理朝妆，宝匣镜凝光。,496,顾敻,71510,虞美人·触帘风送景阳钟
4345,4473,春朝物候妍，愁妇镜台前。,402,郑愔,4976,春怨
4346,4474,媪引浓妆女，儿扶烂醉翁。,529,范成大,71807,寒食郊行书事
4347,4475,笑十三杨柳女儿腰，东风舞。,294,岳珂,71191,满江红·小院深深
4348,4476,妾本秦罗敷，玉颜艳名都。,247,李白,7799,陌上桑
4349,4477,笑绿鬟邻女，倚窗犹唱，夕阳西下。,442,蒋捷,64058,女冠子·元夕
4350,4478,多君相门女，学道爱神仙。,247,李白,8513,送内寻庐山女道士李腾空二首
4351,4479,蔡女菱歌移锦缆，燕姬春望上琼钩。,275,上官仪,2471,咏画障
4352,4480,宫中彩女颜如花，飘然挥手凌紫霞，从风纵体登鸾车。,247,李白,1642,飞龙引二首·其一
4353,4481,玉人垂钓理纤钩。月明池阁夜来秋。,670,吴文英,62277,浣溪沙·波面铜花冷不收
4354,4482,君家玉女从小见，闻道如今画不成。,268,黄庭坚,71816,谢张仲谋端午送巧作
4355,4483,湘女归魂，佩环玉冷无声，凝情谁诉。,670,吴文英,62246,过秦楼·黄钟商芙蓉
4356,4484,百二禁兵辞象阙，三千宫女下龙舟。,267,许浑,28335,汴河亭
4357,4485,池边钓女日相随，妆成照影竟来窥。,757,孟浩然,7302,高阳池送朱二
4358,4486,秦女含颦向烟月，愁红带露空迢迢。,415,温庭筠,31705,惜春词
4359,4487,织妇何太忙，蚕经三卧行欲老。,18,元稹,21053,织妇词
4360,4488,谁向若耶溪上，倩美人西去，麋鹿姑苏。,217,辛弃疾,57993,汉宫春·会稽蓬莱阁怀古
4361,4489,玉座犹寂寞，况乃妾身轻。,32,谢朓,71591,同谢谘议咏铜雀台
4362,4490,话别情多声欲战，玉著痕留红粉面。,496,顾敻,71779,玉楼春·拂水双飞来去燕
4363,4491,朝云乱人目，帝女湘川宿。,534,吴均,71646,登二妃庙
4364,4492,武公不但歌淇澳，贤女犹能唁卫侯。,0,,71840,摘星楼九日登临
4365,4493,凤皇舟上楚女，妙舞，雷喧波上鼓。,455,孙光宪,71739,河传·柳拖金缕
4366,4494,阿香秋梦起娇啼，玉女传幽素。,670,吴文英,62382,烛影摇红·越上霖雨应祷
4367,4495,玉人初上木兰时。懒妆斜立澹春姿。,670,吴文英,62273,浣溪沙·题李中斋舟中梅屏
4368,4496,玉手佳人，笑把琶琶理。,395,顾德辉,72043,蝶恋花·春江暖涨桃花水
4369,4497,至今商女，时时犹唱，后庭遗曲。,405,王安石,49075,桂枝香·金陵怀古
4370,4499,醉后满身花影、倩人扶。,588,晏几道,49302,虞美人·疏梅月下歌金缕
4371,4500,红脸青腰，旧识凌波女。,588,晏几道,49131,蝶恋花·笑艳秋莲生绿浦
4372,4501,不似春风逞红艳，镜前空坠玉人钗。,163,司空图,34271,华下对菊
4373,4502,佳人亦何念，凄断阳关曲。,183,苏轼,71876,送顿起
4374,4503,父耕原上田，子劚山下荒。,687,聂夷中,34411,田家
4375,4504,当时父母念，今日尔应知。,665,白居易,21205,燕诗示刘叟
4376,4505,怡然敬父执，问我来何方？问答乃未已，驱儿罗酒浆。,474,杜甫,10388,赠卫八处士
4377,4508,痴儿不知父子礼，叫怒索饭啼门东。,474,杜甫,10517,百忧集行
4378,4509,雌雄空中鸣，声尽呼不归。,665,白居易,21205,燕诗示刘叟
4379,4510,妙年出补父兄处，公自才力应时须。,268,黄庭坚,71884,送范德孺知庆州
4380,4514,来时父母知隔生，重著衣裳如送死。,482,王建,15767,渡辽水
4381,4515,父老得书知我在，小轩临水为君开。,183,苏轼,71906,送贾讷倅眉
4382,4518,哀哀父母，生我劳瘁。,0,,199,蓼莪
4383,4521,父兮生我，母兮鞠我。,0,,199,蓼莪
4384,4524,谁言寸草心，报得三春晖。,232,孟郊,19328,游子吟
4385,4525,爱子心无尽，归家喜及辰。,189,蒋士铨,71034,岁暮到家 / 岁末到家
4386,4526,母别子，子别母，白日无光哭声苦。,665,白居易,21288,母别子
4387,4527,慈母倚门情，游子行路苦。,511,王冕,71981,墨萱图·其一
4388,4528,有孙母未去，出入无完裙。,474,杜甫,10449,石壕吏
