id,juId,content,poetId,poetName,poetryId,poetryName
2711,2787,黄菊枝头生晓寒。人生莫放酒杯干。,268,黄庭坚,49924,鹧鸪天·座中有眉山隐客史应之和前韵即席答之
2712,2788,不如随分尊前醉，莫负东篱菊蕊黄。,536,李清照,52853,鹧鸪天·寒日萧萧上琐窗
2713,2789,楼倚霜树外，镜天无一毫。,211,杜牧,27599,长安秋望
2714,2790,南浦凄凄别，西风袅袅秋。,665,白居易,22406,南浦别
2715,2791,一轮秋影转金波。飞镜又重磨。,217,辛弃疾,57847,太常引·建康中秋夜为吕叔潜赋
2716,2792,深秋帘幕千家雨，落日楼台一笛风。,211,杜牧,27622,题宣州开元寺水阁阁下宛溪夹溪居人
2717,2793,昨夜秋风入汉关，朔云边月满西山。,681,严武,13270,军城早秋
2718,2794,芙蓉生在秋江上，不向东风怨未开。,734,高蟾,36218,下第后上永崇高侍郎
2719,2795,胭脂洗出秋阶影，冰雪招来露砌魂。,611,曹雪芹,71594,薛宝钗咏白海棠
2720,2796,兰有秀兮菊有芳，怀佳人兮不能忘。,700,刘彻,47937,秋风辞
2721,2797,枫落河梁野水秋。淡烟衰草接郊丘。,467,苏庠,51414,鹧鸪天·枫落河梁野水秋
2722,2798,登舟望秋月，空忆谢将军。,247,李白,8373,夜泊牛渚怀古
2723,2799,龙吟虎啸一时发，万籁百泉相与秋。,671,李颀,6033,听安万善吹觱篥歌
2724,2800,桂魄初生秋露微，轻罗已薄未更衣。,515,王维,18010,秋夜曲
2725,2801,布被秋宵梦觉，眼前万里江山。,217,辛弃疾,57613,清平乐·独宿博山王氏庵
2726,2802,秋到边城角声哀，烽火照高台。,272,陆游,56025,秋波媚·七月十六日晚登高兴亭望长安南山
2727,2803,阴生古苔绿，色染秋烟碧。,247,李白,8445,南轩松
2728,2804,调角断清秋，征人倚戍楼。,336,张乔,34461,书边事
2729,2805,天秋月又满，城阙夜千重。,286,戴叔伦,14182,客夜与故人偶集 / 江乡故人偶集客舍
2730,2806,秋空明月悬，光彩露沾湿。,757,孟浩然,7257,秋宵月下有怀
2731,2807,秋风万里芙蓉国，暮雨千家薜荔村。,548,谭用之,41636,秋宿湘江遇雨
2732,2808,且欲近寻彭泽宰，陶然共醉菊花杯。,775,崔曙,7195,九日登望仙台呈刘明府容
2733,2809,秋阴时晴渐向暝，变一庭凄冷。,164,周邦彦,71422,关河令·秋阴时晴渐向暝
2734,2811,细数十年事，十处过中秋。,529,范成大,56204,水调歌头·细数十年事
2735,2812,秋草独寻人去后，寒林空见日斜时。,104,刘长卿,7072,长沙过贾谊宅
2736,2813,日暮秋烟起，萧萧枫树林。,286,戴叔伦,14343,过三闾庙
2737,2814,晓月暂飞高树里，秋河隔在数峰西。,473,韩翃,15018,宿石邑山中
2738,2815,满载一船秋色，平铺十里湖光。,406,张孝祥,56653,西江月·阻风山峰下
2739,2816,落日心犹壮，秋风病欲疏。,474,杜甫,11290,江汉
2740,2817,明日巴陵道，秋山又几重。,484,李益,14928,喜见外弟又言别
2741,2818,西风乱叶溪桥树。秋在黄花羞涩处。,317,张榘,61374,青玉案·被檄出郊题陈氏山居
2742,2819,空园白露滴，孤壁野僧邻。,465,马戴,30310,灞上秋居
2743,2820,冉冉秋光留不住，满阶红叶暮。,269,李煜,71432,谢新恩·冉冉秋光留不住
2744,2821,野水参差落涨痕，疏林欹倒出霜根。,183,苏轼,71777,书李世南所画秋景二首
2745,2822,微阳下乔木，远色隐秋山。,465,马戴,30260,落日怅望
2746,2823,晚云都变露，新月初学扇，塞鸿一字来如线。,344,周德清,69779,塞鸿秋·浔阳即景
2747,2824,醉里秋波，梦中朝雨，都是醒时烦恼。,233,时彦,65428,青门饮·寄宠人
2748,2825,月到东南秋正半。双阙中间，浩荡流银汉。,408,王国维,71419,蝶恋花·月到东南秋正半
2749,2826,鸟下绿芜秦苑夕，蝉鸣黄叶汉宫秋。,267,许浑,28289,咸阳城东楼 / 咸阳城西楼晚眺
2750,2827,年年陌上生秋草，日日楼中到夕阳。,588,晏几道,49144,鹧鸪天·醉拍春衫惜旧香
2751,2828,雨过月华生，冷彻鸳鸯浦。,535,柳永,48216,甘草子·秋暮
2752,2829,晓迎秋露一枝新，不占园中最上春。,211,杜牧,27826,紫薇花
2753,2830,荒城临古渡，落日满秋山。,515,王维,5638,归嵩山作
2754,2831,枕簟溪堂冷欲秋。断云依水晚来收。,217,辛弃疾,57569,鹧鸪天·鹅湖归病起作
2755,2832,城边有古树，日夕连秋声。,247,李白,8024,沙丘城下寄杜甫
2756,2833,船动湖光滟滟秋，贪看年少信船流。,66,皇甫松,71396,采莲子·船动湖光滟滟秋
2757,2834,南陵水面漫悠悠，风紧云轻欲变秋。,211,杜牧,27799,南陵道中 / 寄远
2758,2835,秋光一片，问苍苍桂影，其中何物？,672,赵秉文,72104,大江东去·用东坡先生韵
2759,2836,满园花菊郁金黄，中有孤丛色似霜。,665,白居易,23107,重阳席上赋白菊
2760,2837,如何肯到清秋日，已带斜阳又带蝉。,204,李商隐,28693,柳
2761,2838,只有一枝梧叶，不知多少秋声。,53,张炎,64278,清平乐·候蛩凄断
2762,2839,秋雨一何碧，山色倚晴空。,478,方岳,61971,水调歌头·平山堂用东坡韵
2763,2840,寒山几堵，风低削碎中原路，秋空一碧无今古。,712,陈维崧,70717,醉落魄·咏鹰
2764,2841,云中君不见，竟夕自悲秋。,465,马戴,70851,楚江怀古三首·其一
2765,2842,常恐秋风早，飘零君不知。,744,卢照邻,2558,曲池荷
2766,2843,鄂王坟上草离离，秋日荒凉石兽危。,651,赵孟頫,69162,岳鄂王墓
2767,2844,竹叶于人既无分，菊花从此不须开。,474,杜甫,71837,九日五首·其一
2768,2845,立秋后三日行，舟之前后，如朝霞相映，望之不断也。,724,陈与义,53476,虞美人·扁舟三日秋塘路
2769,2846,北郭清溪一带流，红桥风物眼中秋，绿杨城郭是扬州。,599,王士祯,70745,浣溪沙·红桥
2770,2847,雨过一蝉噪，飘萧松桂秋。,211,杜牧,27617,题扬州禅智寺
2771,2848,落日塞尘起，胡骑猎清秋。,217,辛弃疾,57538,水调歌头·舟次扬州和人韵
2772,2849,高梧百尺夜苍苍，乱扫秋星落晓霜。,260,郑板桥,71548,咏梧桐
2773,2850,十轮霜影转庭梧，此夕羁人独向隅。,432,晏殊,71826,中秋月
2774,2851,寒眼乱空阔，客意不胜秋。,101,杨炎正,58988,水调歌头·登多景楼
2775,2852,禹庙空山里，秋风落日斜。,474,杜甫,11185,禹庙
2776,2853,汉口夕阳斜渡鸟，洞庭秋水远连天。,104,刘长卿,7086,自夏口至鹦鹉洲夕望岳阳寄源中丞
2777,2854,尘中见月心亦闲，况是清秋仙府间。,197,刘禹锡,71345,八月十五夜桃源玩月
2778,2855,白云映水摇空城，白露垂珠滴秋月。,247,李白,7852,金陵城西楼月下吟
2779,2857,残萤栖玉露，早雁拂金河。,267,许浑,70852,早秋三首·其一
2780,2858,秋气堪悲未必然，轻寒正是可人天。,361,杨万里,72370,秋凉晚步
2781,2859,诗成自写红叶，和恨寄东流。,588,晏几道,49280,诉衷情·凭觞静忆去年秋
2782,2860,采菱人语隔秋烟，波静如横练。,221,王恽,71404,平湖乐·采菱人语隔秋烟
2783,2861,星河秋一雁，砧杵夜千家。,473,韩翃,12344,酬程延秋夜即事见赠
2784,2862,故乡篱下菊，今日几花开。,393,江总,48167,于长安归还扬州九月九日行薇山亭赋韵 / 长安九日诗
2785,2863,何当载酒来，共醉重阳节。,757,孟浩然,7247,秋登兰山寄张五 / 九月九日岘山寄张子容
2786,2864,云物凄凉拂曙流，汉家宫阙动高秋。,10,赵嘏,29749,长安晚秋 / 秋望 / 秋夕
2787,2865,秋波落泗水，海色明徂徕。,247,李白,8119,鲁郡东石门送杜二甫
2788,2866,秋色从西来，苍然满关中。,113,岑参,9259,与高适薛据同登慈恩寺浮图
2789,2867,江皋楼观前朝寺，秋色入秦淮。,476,徐再思,69777,人月圆·甘露怀古
2790,2868,伫听寒声，云深无雁影。,164,周邦彦,71422,关河令·秋阴时晴渐向暝
2791,2869,新寒中酒敲窗雨，残香细袅秋情绪。,188,纳兰性德,71468,菩萨蛮·新寒中酒敲窗雨
2792,2870,秋鬓含霜白，衰颜倚酒红。,832,尹式,48179,别宋常侍
2793,2871,秋色到空闺，夜扫梧桐叶。,526,夏完淳,70706,卜算子·秋色到空闺
2794,2873,断虹霁雨，净秋空，山染修眉新绿。,268,黄庭坚,49867,念奴娇·断虹霁雨
2795,2874,桂魄飞来光射处，冷浸一天秋碧。,183,苏轼,49679,念奴娇·中秋
2796,2875,冷红叶叶下塘秋。长与行云共一舟。,30,姜夔,59322,忆王孙·番阳彭氏小楼作
2797,2876,小溪清水平如镜，一叶飞来浪细生。,3,徐玑,71397,秋行
2798,2877,秋容浅淡映重门，七节攒成雪满盆。,611,曹雪芹,71414,咏白海棠
2799,2878,红蓼渡头秋正雨，印沙鸥迹自成行，整鬟飘袖野风香。,342,薛昭蕴,71063,浣溪沙·红蓼渡头秋正雨
2800,2879,多少天涯未归客，尽借篱落看秋风。,532,唐寅,72129,菊花
2801,2880,寒更承夜永，凉夕向秋澄。,714,骆宾王,4015,送别
2802,2881,鹊飞山月曙，蝉噪野风秋。,275,上官仪,2473,入朝洛堤步月
2803,2882,菊花何太苦，遭此两重阳？,247,李白,8261,九月十日即事
2804,2883,秋风万里动，日暮黄云高。,113,岑参,9233,巩北秋兴寄崔明允
2805,2884,秋在水清山暮蝉，洛阳树色鸣皋烟。,437,王昌龄,6459,送狄宗亨
2806,2885,丹枫万叶碧云边，黄花千点幽岩下。,200,张抡,55273,踏莎行·秋入云山
2807,2886,梧桐真不甘衰谢，数叶迎风尚有声。,179,张耒,70947,夜坐
2808,2887,霜降碧天静，秋事促西风。,71,叶梦得,51982,水调歌头·九月望日与客习射西园余偶病不能射
2809,2888,夕阳鸟外，秋风原上，目断四天垂。,535,柳永,48305,少年游·长安古道马迟迟
2810,2889,绿蓑江上秋闻笛，红袖楼头夜倚栏。,611,曹雪芹,71573,香菱咏月·其三
2811,2890,金河秋半虏弦开，云外惊飞四散哀。,211,杜牧,27667,早雁
2812,2891,对此怀素心，千里共明月。,0,,71399,新秋晚眺
2813,2892,花门楼前见秋草，岂能贫贱相看老。,113,岑参,9331,凉州馆中与诸判官夜集
2814,2893,十二峰头秋草荒，冷烟寒月过瞿塘。,407,何景明,71015,竹枝词
2815,2894,未必素娥无怅恨，玉蟾清冷桂花孤。,432,晏殊,71826,中秋月
2816,2895,秋色冷并刀，一派酸风卷怒涛。,712,陈维崧,70724,南乡子·邢州道上作
2817,2896,吹到一片秋香，清辉了如雪。,188,纳兰性德,71832,琵琶仙·中秋
2818,2897,求得人间成小会，试把金尊傍菊丛。,432,晏殊,48587,破阵子·燕子欲归时节
2819,2898,秋夜访秋士，先闻水上音。,676,袁枚,71036,夜过借园见主人坐月下吹笛
2820,2899,天长雁影稀，月落山容瘦，冷清清暮秋时候。,191,卢挚,71349,沉醉东风·重九
2821,2900,昔看黄菊与君别，今听玄蝉我却回。,197,刘禹锡,18679,始闻秋风
2822,2901,早须清黠虏，无事莫经秋。,113,岑参,9456,送人赴安西
2823,2902,目断秋霄落雁，醉来时响空弦。,217,辛弃疾,57586,木兰花慢·滁州送范倅
2824,2903,秋已尽，日犹长，仲宣怀远更凄凉。,536,李清照,52853,鹧鸪天·寒日萧萧上琐窗
2825,2904,雨荒深院菊，霜倒半池莲。,474,杜甫,10887,宿赞公房
2826,2905,流星飞玉弹，宝剑落秋霜。,445,张玉娘,71319,从军行
2827,2906,明朝万一西风动，争向朱颜不耐秋。,588,晏几道,49139,鹧鸪天·守得莲开结伴游
2828,2907,此时瞻白兔，直欲数秋毫。,474,杜甫,11321,八月十五夜月二首
2829,2908,日夕凉风至，闻蝉但益悲。,757,孟浩然,7319,秦中感秋寄远上人 / 秦中寄远上人
2830,2909,闲鹭栖常早，秋花落更迟。,495,钱起,11826,谷口书斋寄杨补阙
2831,2910,重九开秋节，得一动宸仪。,355,韦安石,4930,奉和九日幸临渭亭登高应制得枝字
2832,2911,山色遥连秦树晚，砧声近报汉宫秋。,473,韩翃,12416,同题仙游观
2833,2912,渐秋阑、雪清玉瘦，向人无限依依。,536,李清照,52795,多丽·咏白菊
2834,2913,欹枕数秋天，蟾蜍下早弦。,188,纳兰性德,71454,菩萨蛮·萧萧几叶风兼雨
2835,2914,凉叶萧萧散雨声，虚堂淅淅掩霜清。,600,元好问,71391,秋怀
2836,2915,三千年事残鸦外，无言倦凭秋树。,670,吴文英,62228,齐天乐·与冯深居登禹陵
2837,2916,凭阑久，金波渐转，白露点苍苔。,125,秦观,50237,满庭芳·碧水惊秋
2838,2917,秋天一夜静无云，断续鸿声到晓闻。,348,张仲素,71410,秋闺思二首
2839,2918,桂花浮玉，正月满天街，夜凉如洗。,21,文征明,71834,念奴娇·中秋对月
2840,2919,远村秋色如画，红树间疏黄。,432,晏殊,48651,诉衷情·芙蓉金菊斗馨香
2841,2920,凭画槛，雨洗秋浓人淡。,763,厉鹗,70770,谒金门·七月既望湖上雨后作
2842,2921,黄花深巷，红叶低窗，凄凉一片秋声。,442,蒋捷,64081,声声慢·秋声
2843,2922,漠漠秋云起，稍稍夜寒生。,665,白居易,21647,微雨夜行
2844,2923,青天蜀道难，红叶吴江冷。,394,张可久,71429,普天乐·秋怀
2845,2924,白雁乱飞秋似雪，清露生凉夜。,8,吴西逸,69760,清江引·秋居
2846,2925,黄河水绕汉宫墙，河上秋风雁几行。,146,李梦阳,69208,秋望
2847,2926,塞上秋风鼓角，城头落日旌旗。,600,元好问,72105,江月晃重山·初到嵩山时作
2848,2927,秋霜切玉剑，落日明珠袍。,247,李白,7777,白马篇
2849,2928,深秋绝塞谁相忆，木叶萧萧。,188,纳兰性德,71859,采桑子·九日
2850,2929,天秋日正中，水碧无尘埃。,646,柳宗元,18276,湘口馆潇湘二水所会
2851,2930,蒂有余香金淡泊，枝无全叶翠离披。,611,曹雪芹,72128,残菊
2852,2931,浓雾知秋晨气润，薄云遮日午阴凉，不须飞盖护戎装。,529,范成大,56279,浣溪沙·江村道中
2853,2932,寂历秋江渔火稀，起看残月映林微。,354,汤显祖,69221,江宿
2854,2933,客睡何曾著，秋天不肯明。,474,杜甫,11059,客夜
2855,2934,银箭金壶漏水多，起看秋月坠江波。,247,李白,1517,乌栖曲
2856,2935,秋晓上莲峰，高蹑倚天青壁。,272,陆游,56004,好事近·秋晓上莲峰
2857,2936,问篱边黄菊，知为谁开。,125,秦观,50237,满庭芳·碧水惊秋
2858,2937,秋晚佳晨重物华，高台复帐驻鸣笳。,596,宋祁,71839,九日置酒
2859,2938,无限枝头好颜色，可怜开不为重阳。,722,丘浚,72124,咏菊
2860,2939,携壶酌流霞，搴菊泛寒荣。,247,李白,8259,九日
2861,2940,萋萋芳草小楼西，云压雁声低。,152,刘基,72050,眼儿媚·秋思
2862,2941,一点烽传散关信，两行雁带杜陵秋。,272,陆游,71409,秋晚登城北楼
2863,2942,自有多情处，明月挂南楼。,697,米芾,50368,水调歌头·中秋
2864,2943,惟有河边雁，秋来南向飞。,662,庾信,48158,重别周尚书
2865,2944,张翰江东去，正值秋风时。,247,李白,8097,送张舍人之江东
2866,2945,杪秋霜露重，晨起行幽谷。,646,柳宗元,18295,秋晓行南谷经荒村
2867,2946,是天外空汗漫，但长风、浩浩送中秋。,217,辛弃疾,57758,木兰花慢·中秋饮酒
2868,2947,凤林关里水东流，白草黄榆六十秋。,390,张籍,71765,凉州词三首·其三
2869,2948,官河水静阑干暖，徙倚斜阳怨晚秋。,729,史达祖,59917,鹧鸪天·卫县道中有怀其人
2870,2949,秋已无多，早是败荷衰柳。,480,潘希白,68175,大有·九日
2871,2950,秋风吹地百草干，华容碧影生晚寒。,349,李贺,20420,开愁歌
2872,2951,今日暂同芳菊酒，明朝应作断蓬飞。,447,王之涣,13038,九日送别
2873,2952,辞君向天姥，拂石卧秋霜。,247,李白,8077,别储邕之剡中
2874,2953,天秋木叶下，月冷莎鸡悲。,247,李白,7821,秋思
2875,2954,旅客三秋至，层城四望开。,647,杜审言,3509,登襄阳城
2876,2955,荻花秋，潇湘夜，橘洲佳景如屏画。,111,李珣,71406,渔歌子·荻花秋
2877,2956,秋霜不惜人，倏忽侵蒲柳。,247,李白,7832,长歌行
2878,2957,山黛远，月波长，暮云秋影蘸潇湘。,304,蔡松年,71280,鹧鸪天·赏荷
2879,2958,镜水夜来秋月，如雪。,415,温庭筠,71766,荷叶杯·镜水夜来秋月
2880,2959,秋晚莼鲈江上，夜深儿女灯前。,217,辛弃疾,57586,木兰花慢·滁州送范倅
2881,2960,最爱芦花经雨后，一蓬烟火饭鱼船。,762,林逋,71599,咏秋江
2882,2961,看蓬门秋草，年年破巷，疏窗细雨，夜夜孤灯。,260,郑板桥,72115,沁园春·恨
2883,2962,千里江山昨梦非，转眼秋光如许。,21,文征明,71834,念奴娇·中秋对月
2884,2963,秋到长门秋草黄。画梁双燕去，出宫墙。,342,薛昭蕴,71415,小重山·秋到长门秋草黄
2885,2964,蓬鬓哀吟长城下，不堪秋气入金疮。,583,卢纶,14564,逢病军人
2886,2965,贾傅松醪酒，秋来美更香。,211,杜牧,27726,送薛种游湖南
2887,2966,五原秋草绿，胡马一何骄。,247,李白,7782,塞上曲
2888,2967,五原秋草绿，胡马一何骄。,247,李白,7782,塞上曲
2889,2968,晴野鹭鸶飞一只，水葓花发秋江碧。,66,皇甫松,47120,天仙子·踯躅花开红照水
2890,2969,回廊远砌生秋草，梦魂千里青门道。,186,冯延巳,71405,菩萨蛮·回廊远砌生秋草
2891,2970,八月寒苇花，秋江浪头白。,671,李颀,6043,送刘昱
2892,2971,红叶满寒溪，一路空山万木齐。,188,纳兰性德,71411,南乡子·秋暮村居
2893,2972,栖鸦流水点秋光，爱此萧疏树几行。,346,纪映淮,71553,咏秋柳
2894,2973,黄华自与西风约，白发先从远客生。,600,元好问,71391,秋怀
2895,2974,问他有甚堪悲处？思量却也有悲时，重阳节近多风雨。,217,辛弃疾,58006,踏莎行·庚戌中秋后二夕带湖篆冈小酌
2896,2975,今夕不登楼，一年空过秋。,287,高观国,59949,菩萨蛮·何须急管吹云暝
2897,2976,霜威出塞早，云色渡河秋。,247,李白,8338,太原早秋
2898,2977,凄恻近长沙，地僻秋将尽。,541,杨冠卿,57486,卜算子·秋晚集杜句吊贾傅
2899,2978,辞柯霜叶，飞来就我题红。,2475,朱庭玉,72378,天净沙·秋
2900,2979,秋风起兮木叶飞，吴江水兮鲈正肥。,251,张翰,70895,思吴江歌
2901,2980,渌水明秋月，南湖采白蘋。,247,李白,7817,渌水曲
2902,2981,砧杵敲残深巷月，井梧摇落故园秋。,272,陆游,69131,秋思
2903,2982,早是他乡值早秋，江亭明月带江流。,289,王勃,3220,秋江送别二首
2904,2983,羁心积秋晨，晨积展游眺。,758,谢灵运,48081,七里濑
2905,2984,秋风夜渡河，吹却雁门桑。,437,王昌龄,6295,塞下曲·秋风夜渡河
2906,2985,芜然蕙草暮，飒尔凉风吹。,247,李白,7821,秋思
2907,2986,万里平湖秋色冷，星辰垂影参然。,594,牛希济,71621,临江仙·洞庭波浪颭晴天
2908,2987,古戍三秋雁，高台万木风。,128,屈大均,71683,鲁连台
2909,2988,戛戛秋蝉响似筝，听蝉闲傍柳边行。,3,徐玑,71397,秋行
2910,2989,秋萧索。梧桐落尽西风恶。,468,黄机,60770,忆秦娥·秋萧索
2911,2990,霜天秋晓，正紫塞故垒，黄云衰草。,300,蔡挺,71393,喜迁莺·霜天秋晓
2912,2991,深秋寒夜银河静，月明深院中庭。,132,尹鹗,72004,临江仙·深秋寒夜银河静
2913,2992,梧桐雨细。渐滴作秋声，被风惊碎。,380,张辑,60816,疏帘淡月·寓桂枝香秋思
2914,2993,短篱残菊一枝黄。正是乱山深处、过重阳。,644,吕本中,52886,南歌子·驿路侵斜月
2915,2994,西风来劝凉云去，天东放开金镜。,729,史达祖,59898,齐天乐·中秋宿真定驿
2916,2995,况屈指中秋，十分好月，不照人圆。,217,辛弃疾,57586,木兰花慢·滁州送范倅
2917,2996,今日云景好，水绿秋山明。,247,李白,8259,九日
2918,2997,秋菊堪餐，春兰可佩，留待先生手自栽。,217,辛弃疾,57517,沁园春·带湖新居将成
2919,2998,明月青山夜，高天白露秋。,521,李峤,3257,同赋山居七夕
2920,2999,一点残红欲尽时。乍凉秋气满屏帏。,87,周紫芝,52549,鹧鸪天·一点残红欲尽时
2921,3000,秋草六朝寒，花雨空坛。,637,朱彝尊,70733,卖花声·雨花台
2922,3001,日暮平沙秋草乱，一双白鸟避人飞。,61,袁宏道,71024,感事
2923,3002,云山行处合，风雨兴中秋。,227,高适,10290,送魏八
2924,3003,凭觞静忆去年秋，桐落故溪头。,588,晏几道,49280,诉衷情·凭觞静忆去年秋
2925,3004,坐开桑落酒，来把菊花枝。,474,杜甫,10816,九日杨奉先会白水崔明府
2926,3005,时靸双鸳响，廊叶秋声。,670,吴文英,62429,八声甘州·灵岩陪庾幕诸公游
2927,3006,萧萧落木不胜秋，莫回首、斜阳下。,188,纳兰性德,71764,一络索·过尽遥山如画
2928,3007,洞庭叶未下，潇湘秋欲生。,450,徐祯卿,71013,在武昌作
2929,3008,春山碧树秋重绿，人在武陵溪。,152,刘基,72050,眼儿媚·秋思
2930,3009,拜华星之坠几，约明月之浮槎。,173,文天祥,71828,回董提举中秋请宴启
2931,3010,晴云满户团倾盖，秋水浮阶溜决渠。,474,杜甫,11459,柏学士茅屋
2932,3011,中秋月。月到中秋偏皎洁。,748,徐有贞,70693,中秋月·中秋月
2933,3012,靡靡秋已夕，凄凄风露交。,645,陶渊明,71857,己酉岁九月九日
2934,3013,黄云万里动风色，白波九道流雪山。,247,李白,8040,庐山谣寄卢侍御虚舟
2935,3014,地白风色寒，雪花大如手。,247,李白,8410,嘲王历阳不肯饮酒
2936,3015,一条藤径绿，万点雪峰晴。,247,李白,8529,冬日归旧山
2937,3016,黄河捧土尚可塞，北风雨雪恨难裁。,247,李白,7739,北风行
2938,3017,窗含西岭千秋雪，门泊东吴万里船。,474,杜甫,71194,绝句
2939,3018,西山白雪三城戍，南浦清江万里桥。,474,杜甫,11038,野望
2940,3019,岁暮阴阳催短景，天涯霜雪霁寒宵。,474,杜甫,11218,阁夜
2941,3020,其余七匹亦殊绝，迥若寒空动烟雪。,474,杜甫,10611,韦讽录事宅观曹将军画马图
2942,3021,十月江南天气好，可怜冬景似春华。,665,白居易,22587,早冬
2943,3022,夜深知雪重，时闻折竹声。,665,白居易,21659,夜雪
2944,3023,欲将轻骑逐，大雪满弓刀。,583,卢纶,70883,和张仆射塞下曲·其三
2945,3024,草枯鹰眼疾，雪尽马蹄轻。,515,王维,5647,观猎
2946,3025,隔牖风惊竹，开门雪满山。,515,王维,5585,冬晚对雪忆胡居士家
2947,3026,云横秦岭家何在？雪拥蓝关马不前。,682,韩愈,17931,左迁至蓝关示侄孙湘
2948,3027,古戍苍苍烽火寒，大荒沈沈飞雪白。,671,李颀,6046,听董大弹胡笳声兼寄语弄房给事
2949,3028,野云万里无城郭，雨雪纷纷连大漠。,671,李颀,6013,古从军行
2950,3029,六出飞花入户时，坐看青竹变琼枝。,91,高骈,47532,对雪
2951,3030,千里黄云白日曛，北风吹雁雪纷纷。,227,高适,10348,别董大二首
2952,3031,不知庭霰今朝落，疑是林花昨夜开。,248,宋之问,3093,苑中遇雪应制
2953,3032,终南阴岭秀，积雪浮云端。,508,祖咏,5970,终南望余雪
2954,3034,墙角数枝梅，凌寒独自开。,405,王安石,70927,梅花
2955,3035,明月照积雪，朔风劲且哀。,758,谢灵运,71240,岁暮
2956,3036,溪深难受雪，山冻不流云。,764,洪升,71243,雪望
2957,3037,凄凄岁暮风，翳翳经日雪。,645,陶渊明,71242,癸卯岁十二月中作与从弟敬远
2958,3038,雪似梅花，梅花似雪。似和不似都奇绝。,644,吕本中,52896,踏莎行·雪似梅花
2959,3039,万里寒光生积雪，三边曙色动危旌。,508,祖咏,5961,望蓟门
2960,3040,乱云低薄暮，急雪舞回风。,474,杜甫,10831,对雪
2961,3041,砌下落梅如雪乱，拂了一身还满。,269,李煜,47045,清平乐·别来春半
2962,3042,大雪压青松，青松挺且直。,0,,71239,青松
2963,3043,北国风光，千里冰封，万里雪飘。,0,,71250,沁园春·雪
2964,3044,朔风如解意，容易莫摧残。,31,崔道融,39390,梅花
2965,3045,柴门闻犬吠，风雪夜归人。,104,刘长卿,6588,逢雪宿芙蓉山主人
2966,3046,晚来天欲雪，能饮一杯无。,665,白居易,22150,问刘十九
2967,3047,若似月轮终皎洁，不辞冰雪为卿热。,188,纳兰性德,70750,蝶恋花·辛苦最怜天上月
2968,3048,最爱东山晴后雪，软红光里涌银山。,361,杨万里,71252,雪后晚晴四山皆青惟东山全白赋最爱东山晴后雪二绝句
2969,3049,纷纷暮雪下辕门，风掣红旗冻不翻。,113,岑参,9315,白雪歌送武判官归京
2970,3050,皑如山上雪，皎若云间月。,785,卓文君,47866,白头吟
2971,3051,梅雪争春未肯降，骚人搁笔费评章。,94,卢梅坡,70989,雪梅·其一
2972,3052,江南几度梅花发，人在天涯鬓已斑。,328,刘著,72034,鹧鸪天·雪照山城玉指寒
2973,3053,雪里已知春信至。寒梅点缀琼枝腻。,536,李清照,52788,渔家傲·雪里已知春信至
2974,3054,冰雪林中著此身，不同桃李混芳尘；,511,王冕,69174,白梅
2975,3055,雪洗虏尘静，风约楚云留。,406,张孝祥,56549,水调歌头·和庞佑父
2976,3056,君不见走马川行雪海边，平沙莽莽黄入天。,113,岑参,9323,走马川行奉送出师西征 / 走马川行奉送封大夫出师西征
2977,3057,城雪初消荠菜生，角门深巷少人行。,229,杨载,71000,到京师
2978,3058,前村深雪里，昨夜一枝开。,2,齐己,45015,早梅
2979,3059,林表明霁色，城中增暮寒。,508,祖咏,5970,终南望余雪
2980,3060,万树寒无色，南枝独有花。,0,,71715,早梅
2981,3061,怒涛卷霜雪，天堑无涯。,535,柳永,48343,望海潮·东南形胜
2982,3062,马毛带雪汗气蒸，五花连钱旋作冰，幕中草檄砚水凝。,113,岑参,9323,走马川行奉送出师西征 / 走马川行奉送封大夫出师西征
2983,3063,天将暮，雪乱舞，半梅花半飘柳絮。,306,马致远,71494,寿阳曲·江天暮雪
