id,juId,content,poetId,poetName,poetryId,poetryName
1,2,山不在高，有仙则名。水不在深，有龙则灵。,197,刘禹锡,71138,陋室铭
2,3,醉翁之意不在酒，在乎山水之间也。,561,欧阳修,47919,醉翁亭记
3,4,万里赴戎机，关山度若飞。,0,,71131,木兰诗 / 木兰辞
4,5,蜀江水碧蜀山青，圣主朝朝暮暮情。,665,白居易,21744,长恨歌
5,6,蓬山此去无多路，青鸟殷勤为探看。,204,李商隐,28698,无题·相见时难别亦难
6,7,骊山语罢清宵半，泪雨霖铃终不怨。,188,纳兰性德,70753,木兰花·拟古决绝词柬友
7,8,问君能有几多愁？恰似一江春水向东流。,269,李煜,70838,虞美人·春花秋月何时了
8,9,轮台东门送君去，去时雪满天山路。,113,岑参,9315,白雪歌送武判官归京
9,11,泉眼无声惜细流，树阴照水爱晴柔。,361,杨万里,70970,小池
10,12,孤山寺北贾亭西，水面初平云脚低。,665,白居易,22550,钱塘湖春行
11,13,七八个星天外，两三点雨山前。,217,辛弃疾,57678,西江月·夜行黄沙道中
12,14,枯藤老树昏鸦，小桥流水人家，古道西风瘦马。,306,马致远,69957,天净沙·秋思
13,15,欲渡黄河冰塞川，将登太行雪满山。,247,李白,70874,行路难·其一
14,16,落霞与孤鹜齐飞，秋水共长天一色。,289,王勃,47909,滕王阁序
15,17,寒雨连江夜入吴，平明送客楚山孤。,437,王昌龄,70843,芙蓉楼送辛渐
16,18,谁道人生无再少？门前流水尚能西！休将白发唱黄鸡。,183,苏轼,49573,浣溪沙·游蕲水清泉寺
17,19,春江潮水连海平，海上明月共潮生。,756,张若虚,5256,春江花月夜
18,20,胜日寻芳泗水滨，无边光景一时新。,459,朱熹,70974,春日
19,21,水何澹澹，山岛竦峙。,552,曹操,48005,观沧海
20,22,千山鸟飞绝，万径人踪灭。,646,柳宗元,18302,江雪
21,23,山重水复疑无路，柳暗花明又一村。,272,陆游,69127,游山西村
22,24,花自飘零水自流。一种相思，两处闲愁。,536,李清照,52802,一剪梅·红藕香残玉簟秋
23,25,绿树村边合，青山郭外斜。,757,孟浩然,7411,过故人庄
24,26,采菊东篱下，悠然见南山。,645,陶渊明,70898,饮酒·其五
25,27,咬定青山不放松，立根原在破岩中。,573,郑燮,69361,竹石
26,28,千锤万凿出深山，烈火焚烧若等闲。,654,于谦,69198,石灰吟
27,29,空山新雨后，天气晚来秋。,515,王维,5636,山居秋暝
28,30,客路青山外，行舟绿水前。,117,王湾,5207,次北固山下
29,31,风烟俱净，天山共色。,534,吴均,71147,与朱元思书
30,32,君问归期未有期，巴山夜雨涨秋池。,204,李商隐,28607,夜雨寄北
31,33,京口瓜洲一水间，钟山只隔数重山。,405,王安石,69089,泊船瓜洲
32,34,会当凌绝顶，一览众山小。,474,杜甫,10374,望岳
33,35,巴山楚水凄凉地，二十三年弃置身。,197,刘禹锡,18709,酬乐天扬州初逢席上见赠
34,36,不识庐山真面目，只缘身在此山中。,183,苏轼,69101,题西林壁
35,37,水光潋滟晴方好，山色空蒙雨亦奇。,183,苏轼,70938,饮湖上初晴后雨二首·其二
36,38,山一程，水一程，身向榆关那畔行，夜深千帐灯。,188,纳兰性德,70751,长相思·山一程
37,39,烟笼寒水月笼沙，夜泊秦淮近酒家。,211,杜牧,27713,泊秦淮
38,40,绿遍山原白满川，子规声里雨如烟。,103,翁卷,70979,乡村四月
39,41,水是眼波横，山是眉峰聚。,270,王观,65231,卜算子·送鲍浩然之浙东
40,42,飞流直下三千尺，疑是银河落九天。,247,李白,71193,望庐山瀑布
41,43,青山横北郭，白水绕东城。,247,李白,8156,送友人
42,44,日日思君不见君，共饮长江水。,578,李之仪,49753,卜算子·我住长江头
43,45,日出江花红胜火，春来江水绿如蓝。,665,白居易,2077,忆江南·江南好
44,46,桃花潭水深千尺，不及汪伦送我情。,247,李白,8014,赠汪伦
45,47,白日依山尽，黄河入海流。,447,王之涣,13034,登鹳雀楼
46,48,西塞山前白鹭飞，桃花流水鳜鱼肥。,331,张志和,71049,渔歌子·西塞山前白鹭飞
47,50,千里莺啼绿映红，水村山郭酒旗风。,211,杜牧,27620,江南春
48,51,滚滚长江东逝水，浪花淘尽英雄。,181,杨慎,70696,临江仙·滚滚长江东逝水
49,52,青山依旧在，几度夕阳红。,181,杨慎,70696,临江仙·滚滚长江东逝水
50,53,远看山有色，近听水无声。,515,王维,71047,画
51,54,山映斜阳天接水。芳草无情，更在斜阳外。,510,范仲淹,48203,苏幕遮·怀旧
52,55,人闲桂花落，夜静春山空。,515,王维,5753,鸟鸣涧
53,56,种豆南山下，草盛豆苗稀。,645,陶渊明,70897,归园田居·其三
54,57,山随平野尽，江入大荒流。,247,李白,8089,渡荆门送别
55,58,仍怜故乡水，万里送行舟。,247,李白,8089,渡荆门送别
56,59,黑云翻墨未遮山，白雨跳珠乱入船。,183,苏轼,69100,六月二十七日望湖楼醉书
57,60,料峭春风吹酒醒，微冷，山头斜照却相迎。,183,苏轼,49436,定风波·莫听穿林打叶声
58,61,峨眉山月半轮秋，影入平羌江水流。,247,李白,7863,峨眉山月歌
59,62,姑苏城外寒山寺，夜半钟声到客船。,747,张继,12271,枫桥夜泊
60,63,燕子飞时，绿水人家绕。,183,苏轼,49481,蝶恋花·春景
61,64,竹外桃花三两枝，春江水暖鸭先知。,183,苏轼,69102,惠崇春江晚景二首 / 惠崇春江晓景二首
62,65,远上寒山石径斜，白云生处有人家。,211,杜牧,27824,山行
63,66,青山绿水，白草红叶黄花。,278,白朴,71197,天净沙·秋
64,67,半卷红旗临易水，霜重鼓寒声不起。,349,李贺,20285,雁门太守行
65,68,天门中断楚江开，碧水东流至此回。,247,李白,8328,望天门山
66,69,自是人生长恨，水长东。,269,李煜,47040,相见欢·林花谢了春红
67,70,黄河远上白云间，一片孤城万仞山。,447,王之涣,70868,凉州词二首·其一
68,71,飞来山上千寻塔，闻说鸡鸣见日升。,405,王安石,69088,登飞来峰
69,72,山光悦鸟性，潭影空人心。,443,常建,6525,题破山寺后禅院
70,73,郁孤台下清江水，中间多少行人泪？,217,辛弃疾,57580,菩萨蛮·书江西造口壁
71,74,西北望长安，可怜无数山。,217,辛弃疾,57580,菩萨蛮·书江西造口壁
72,75,青山遮不住，毕竟东流去。,217,辛弃疾,57580,菩萨蛮·书江西造口壁
73,76,江晚正愁余，山深闻鹧鸪。,217,辛弃疾,57580,菩萨蛮·书江西造口壁
74,77,流水落花春去也，天上人间。,269,李煜,71076,浪淘沙令·帘外雨潺潺
75,78,抽刀断水水更流，举杯消愁愁更愁。,247,李白,8180,宣州谢脁楼饯别校书叔云
76,79,昔闻洞庭水，今上岳阳楼。,474,杜甫,11550,登岳阳楼
77,80,戎马关山北，凭轩涕泗流。,474,杜甫,11550,登岳阳楼
78,81,风休住。蓬舟吹取三山去。,536,李清照,52792,渔家傲·天接云涛连晓雾
79,82,白露横江，水光接天。,183,苏轼,47921,前赤壁赋
80,83,一水护田将绿绕，两山排闼送青来。,405,王安石,69085,书湖阴先生壁
81,84,春山暖日和风，阑干楼阁帘栊，杨柳秋千院中。,278,白朴,71226,天净沙·春
82,85,啼莺舞燕，小桥流水飞红。,278,白朴,71226,天净沙·春
83,86,遥望洞庭山水色，白银盘里一青螺。,197,刘禹锡,19085,望洞庭
84,87,问渠哪得清如许？为有源头活水来。,459,朱熹,69142,观书有感二首·其一
85,88,山不厌高，海不厌深。,552,曹操,48003,短歌行
86,89,云收雨过波添，楼高水冷瓜甜，绿树阴垂画檐。,278,白朴,71388,天净沙·夏
87,90,去来江口守空船，绕船月明江水寒。,665,白居易,21750,琵琶行 / 琵琶引
88,91,树树皆秋色，山山唯落晖。,464,王绩,2369,野望
89,92,峰峦如聚，波涛如怒，山河表里潼关路。,41,张养浩,71201,山坡羊·潼关怀古
90,93,一道残阳铺水中，半江瑟瑟半江红。,665,白居易,22492,暮江吟
91,94,风萧萧兮易水寒，壮士一去兮不复还。,0,,47688,荆轲歌 / 渡易水歌
92,95,相看两不厌，只有敬亭山。,247,李白,8411,独坐敬亭山
93,96,两岸猿声啼不住，轻舟已过万重山。,247,李白,8345,早发白帝城 / 白帝下江陵
94,97,空山不见人，但闻人语响。,515,王维,5737,鹿柴
95,98,人道山长水又断。萧萧微雨闻孤馆。,536,李清照,52803,蝶恋花·泪湿罗衣脂粉满
96,99,又闻子规啼夜月，愁空山。,247,李白,7717,蜀道难
97,100,青海长云暗雪山，孤城遥望玉门关。,437,王昌龄,71207,从军行七首·其四
98,101,眼见的吹翻了这家，吹伤了那家，只吹的水尽鹅飞罢！,519,王磐,71204,朝天子·咏喇叭
99,102,江碧鸟逾白，山青花欲燃。,474,杜甫,11131,绝句二首
100,103,水晶帘动微风起，满架蔷薇一院香。,91,高骈,47522,山亭夏日
101,104,山外青山楼外楼，西湖歌舞几时休？,283,林升,70973,题临安邸
102,105,山路元无雨，空翠湿人衣。,515,王维,71237,山中
103,106,楚天千里清秋，水随天去秋无际。,217,辛弃疾,57521,水龙吟·登建康赏心亭
104,107,上有青冥之长天，下有渌水之波澜。,247,李白,7727,长相思·其一
105,108,小山重叠金明灭，鬓云欲度香腮雪。,415,温庭筠,71056,菩萨蛮·小山重叠金明灭
106,109,一声画角谯门，丰庭新月黄昏，雪里山前水滨。,278,白朴,71436,天净沙·冬
107,110,八月湖水平，涵虚混太清。,757,孟浩然,7312,望洞庭湖赠张丞相 / 临洞庭湖赠张丞相
108,111,槲叶落山路，枳花明驿墙。,415,温庭筠,31860,商山早行
109,112,黄师塔前江水东，春光懒困倚微风。,474,杜甫,71213,江畔独步寻花·其五
110,113,人间四月芳菲尽，山寺桃花始盛开。,665,白居易,22098,大林寺桃花
111,114,况属高风晚，山山黄叶飞。,289,王勃,3213,山中
112,115,正入万山圈子里，一山放过一山拦。,361,杨万里,71199,过松源晨炊漆公店
113,116,少无适俗韵，性本爱丘山。,645,陶渊明,70896,归园田居·其一
114,117,敕勒川，阴山下。天似穹庐，笼盖四野。,0,,48041,敕勒歌
115,118,盈盈一水间，脉脉不得语。,0,,47873,迢迢牵牛星
116,119,二分尘土，一分流水。,183,苏轼,49377,水龙吟·次韵章质夫杨花词
117,120,躞蹀御沟上，沟水东西流。,785,卓文君,47866,白头吟
118,121,一重山，两重山。山远天高烟水寒，相思枫叶丹。,269,李煜,71075,长相思·一重山
119,122,杨柳青青江水平，闻郎江上踏歌声。,197,刘禹锡,71284,竹枝词二首·其一
120,123,适与野情惬，千山高复低。,131,梅尧臣,69071,鲁山山行
121,124,此生谁料，心在天山，身老沧洲。,272,陆游,56087,诉衷情·当年万里觅封侯
122,125,三山半落青天外，二水中分白鹭洲。,247,李白,8279,登金陵凤凰台
123,126,荷笠带斜阳，青山独归远。,104,刘长卿,6606,送灵澈上人
124,127,青山飞起不压物，野水流来欲湿人。,895,牛殳,42154,琵琶行
125,128,又似贾客蜀道间，千铎万磬鸣空山。,895,牛殳,42154,琵琶行
126,129,引之于山，兽不能走。吹之于水，鱼不能游。,895,牛殳,42154,琵琶行
127,130,日暮苍山远，天寒白屋贫。,104,刘长卿,6588,逢雪宿芙蓉山主人
128,131,明月出天山，苍茫云海间。,247,李白,7741,关山月
129,132,唯有门前镜湖水，春风不改旧时波。,368,贺知章,5124,回乡偶书二首
130,133,若非群玉山头见，会向瑶台月下逢。,247,李白,2025,清平调·其一
131,134,孤之有孔明，犹鱼之有水也。,326,陈寿,71155,隆中对
132,135,万岁山前珠翠绕，蓬壶殿里笙歌作。,630,岳飞,64946,满江红·登黄鹤楼有感
133,136,中岁颇好道，晚家南山陲。,515,王维,5637,终南别业
134,137,行到水穷处，坐看云起时。,515,王维,5637,终南别业
135,138,我家襄水曲，遥隔楚云端。,757,孟浩然,7336,早寒江上有怀 / 早寒有怀
136,139,过尽千帆皆不是，斜晖脉脉水悠悠。,415,温庭筠,71055,望江南·梳洗罢
137,140,大漠沙如雪，燕山月似钩。,349,李贺,71220,马诗二十三首·其五
138,141,冰，水为之，而寒于水。,320,荀子,71176,劝学
139,142,故不登高山，不知天之高也；不临深溪，不知地之厚也；,320,荀子,71176,劝学
140,143,积土成山，风雨兴焉；积水成渊，蛟龙生焉；,320,荀子,71176,劝学
141,144,玉在山而草润，渊生珠而崖不枯。,320,荀子,71176,劝学
142,145,白毛浮绿水，红掌拨清波。,714,骆宾王,4017,咏鹅
143,146,但使龙城飞将在，不教胡马度阴山。,437,王昌龄,6433,出塞二首
144,147,山中相送罢，日暮掩柴扉。,515,王维,5762,送别 / 山中送别
145,148,不论平地与山尖，无限风光尽被占。,135,罗隐,35987,蜂
146,149,骊山四顾，阿房一炬，当时奢侈今何处？,41,张养浩,71203,山坡羊·骊山怀古
147,150,唯有长江水，无语东流。,535,柳永,48358,八声甘州·对潇潇暮雨洒江天
148,151,山寺月中寻桂子，郡亭枕上看潮头。,665,白居易,47086,忆江南三首
149,152,疏影横斜水清浅，暗香浮动月黄昏。,762,林逋,69062,山园小梅二首
150,153,欲寄彩笺兼尺素。山长水阔知何处。,432,晏殊,48478,蝶恋花·槛菊愁烟兰泣露
151,154,山际见来烟，竹中窥落日。,534,吴均,48134,山中杂诗
152,155,曾经沧海难为水，除却巫山不是云。,18,元稹,71940,离思五首·其四
153,156,旧山松竹老，阻归程。,630,岳飞,64944,小重山·昨夜寒蛩不住鸣
154,157,百啭千声随意移，山花红紫树高低。,561,欧阳修,69077,画眉鸟
155,158,力拔山兮气盖世。时不利兮骓不逝。,253,项羽,47932,垓下歌
156,159,春水碧于天，画船听雨眠。,622,韦庄,71058,菩萨蛮·人人尽说江南好
157,160,楼头客子杪秋后，日落君山元气中。,724,陈与义,71661,登岳阳楼二首
158,161,北极朝廷终不改，西山寇盗莫相侵。,474,杜甫,11149,登楼
159,162,山有木兮木有枝，心悦君兮君不知。,0,,47734,越人歌
160,163,梅子黄时日日晴，小溪泛尽却山行。,142,曾几,69119,三衢道中
161,164,招魂楚些何嗟及，山鬼暗啼风雨。,600,元好问,71618,摸鱼儿·雁丘词 / 迈陂塘
162,165,明日隔山岳，世事两茫茫。,474,杜甫,10388,赠卫八处士
163,166,试上超然台上看，半壕春水一城花。,183,苏轼,49455,望江南·超然台作
164,167,更吹羌笛关山月，无那金闺万里愁。,437,王昌龄,6432,从军行七首
165,168,玉门山嶂几千重，山北山南总是烽。,437,王昌龄,6432,从军行七首
166,169,山无陵，江水为竭。冬雷震震，夏雨雪。天地合，乃敢与君绝。,0,,47955,上邪
167,170,朝看水东流，暮看日西坠。,813,钱福,72374,明日歌
168,171,晨昏滚滚水东流，今古悠悠日西坠。,813,钱福,72374,明日歌
169,172,青山隐隐水迢迢，秋尽江南草未凋。,211,杜牧,27724,寄扬州韩绰判官
170,173,漠漠轻寒上小楼。晓阴无赖似穷秋。淡烟流水画屏幽。,125,秦观,50257,浣溪沙·漠漠轻寒上小楼
171,174,最是繁丝摇落后，转教人忆春山。,188,纳兰性德,70754,临江仙·寒柳
172,175,庭前落尽梧桐，水边开彻芙蓉。,2475,朱庭玉,72378,天净沙·秋
173,176,四十年来家国，三千里地山河。,269,李煜,47057,破阵子·四十年来家国
174,177,不知近水花先发，疑是经冬雪未销。,708,张谓,9209,早梅
175,178,江水漾西风，江花脱晚红。,405,王安石,72393,江上
176,180,有耳莫洗颍川水，有口莫食首阳蕨。,247,李白,7726,行路难三首
177,181,谢公宿处今尚在，渌水荡漾清猿啼。,247,李白,8066,梦游天姥吟留别 / 梦游天姥山别东鲁诸公
178,182,云青青兮欲雨，水澹澹兮生烟。,247,李白,8066,梦游天姥吟留别 / 梦游天姥山别东鲁诸公
179,183,世间行乐亦如此，古来万事东流水。,247,李白,8066,梦游天姥吟留别 / 梦游天姥山别东鲁诸公
180,184,别君去兮何时还？且放白鹿青崖间。须行即骑访名山。,247,李白,8066,梦游天姥吟留别 / 梦游天姥山别东鲁诸公
181,185,河水萦带，群山纠纷。,334,李华,72172,吊古战场文
182,186,鸟无声兮山寂寂，夜正长兮风淅淅。,334,李华,72172,吊古战场文
183,187,寒雨连天夜入吴，平明送客楚山孤。,437,王昌龄,6461,芙蓉楼送辛渐二首
184,188,情知已被山遮断，频倚阑干不自由。,217,辛弃疾,57565,鹧鸪天·代人赋
185,189,浮天水送无穷树，带雨云埋一半山。,217,辛弃疾,57567,鹧鸪天·送人
186,190,命如南山石，四体康且直！,0,,71170,孔雀东南飞 / 古诗为焦仲卿妻作
187,192,水急客舟疾，山花拂面香。,247,李白,7859,秋浦歌十七首
188,193,稻根科斗行如块，田水今年一尺宽。,529,范成大,71303,夏日田园杂兴
189,194,只有天在上，更无山与齐。,184,寇准,71595,咏华山
190,195,移舟水溅差差绿，倚槛风摆柄柄香。,434,郑谷,36719,莲叶
191,196,只在此山中，云深不知处。,491,贾岛,31653,寻隐者不遇 / 孙革访羊尊师诗
192,197,山高月小，水落石出。,183,苏轼,47922,后赤壁赋
193,198,划然长啸，草木震动，山鸣谷应，风起水涌。,183,苏轼,47922,后赤壁赋
194,199,雨落不上天，水覆难再收。,247,李白,1682,妾薄命
195,200,画栋朝飞南浦云，珠帘暮卷西山雨。,289,王勃,3163,滕王阁诗
196,201,亭亭山上松，瑟瑟谷中风。,695,刘桢,48013,赠从弟
197,202,溪云初起日沉阁，山雨欲来风满楼。,267,许浑,28289,咸阳城东楼 / 咸阳城西楼晚眺
198,203,世事漫随流水，算来一梦浮生。,269,李煜,47048,乌夜啼·昨夜风兼雨
199,204,君言不得意，归卧南山陲。,515,王维,5491,送别
200,205,隋堤上、曾见几番，拂水飘绵送行色。,164,周邦彦,51015,兰陵王·柳
201,206,离多最是，东西流水，终解两相逢。,588,晏几道,49296,少年游·离多最是
202,207,连山变幽晦，绿水函晏温。,646,柳宗元,18337,饮酒
203,208,鹅湖山下稻粱肥，豚栅鸡栖半掩扉。,786,王驾,37731,社日
204,209,水远烟微。一点沧洲白鹭飞。,561,欧阳修,48727,采桑子·何人解赏西湖好
205,210,山抹微云，天连衰草，画角声断谯门。,125,秦观,50235,满庭芳·山抹微云
206,211,斜阳外，寒鸦万点，流水绕孤村。,125,秦观,50235,满庭芳·山抹微云
207,212,吴丝蜀桐张高秋，空山凝云颓不流。,349,李贺,20270,李凭箜篌引
208,213,昆山玉碎凤凰叫，芙蓉泣露香兰笑。,349,李贺,20270,李凭箜篌引
209,214,闻道梅花坼晓风，雪堆遍满四山中。,272,陆游,69132,梅花绝句·其一
210,215,逢郎欲语低头笑，碧玉搔头落水中。,665,白居易,22497,采莲曲
211,216,叶上初阳干宿雨、水面清圆，一一风荷举。,164,周邦彦,50973,苏幕遮·燎沉香
212,217,海阔山遥，未知何处是潇湘。,535,柳永,48346,玉蝴蝶·望处雨收云断
213,219,远岫出山催薄暮，细风吹雨弄轻阴。,536,李清照,52847,浣溪沙·小院闲窗春色深
214,220,初闻征雁已无蝉，百尺楼高水接天。,204,李商隐,28576,霜月
215,221,认得醉翁语，山色有无中。,183,苏轼,49384,水调歌头·黄州快哉亭赠张偓佺
216,222,若得山花插满头，莫问奴归处。,214,严蕊,66149,卜算子·不是爱风尘
217,223,低头弄莲子，莲子清如水。,0,,48064,西洲曲
218,224,海水梦悠悠，君愁我亦愁。,0,,48064,西洲曲
219,225,一往情深深几许？深山夕照深秋雨。,188,纳兰性德,71687,蝶恋花·出塞
220,226,莫买沃洲山，时人已知处。,104,刘长卿,6605,送方外上人 / 送上人
221,227,淡荡春光寒食天。玉炉沈水袅残烟。梦回山枕隐花钿。,536,李清照,52800,浣溪沙·淡荡春光寒食天
222,228,万壑树参天，千山响杜鹃。,515,王维,5611,送梓州李使君
223,229,请君试问东流水，别意与之谁短长。,247,李白,8080,金陵酒肆留别
224,230,穿花蛱蝶深深见，点水蜻蜓款款飞。,474,杜甫,10853,曲江二首
225,231,草满池塘水满陂，山衔落日浸寒漪。,230,雷震,71216,村晚
226,232,半生已分孤眠过，山枕檀痕涴。,188,纳兰性德,71942,虞美人·曲阑深处重相见
227,233,舍南舍北皆春水，但见群鸥日日来。,474,杜甫,10965,客至
228,234,郴江幸自绕郴山，为谁流下潇湘去。,125,秦观,50249,踏莎行·郴州旅舍
229,235,落木千山天远大，澄江一道月分明。,268,黄庭坚,69107,登快阁
230,236,无限河山泪，谁言天地宽！,526,夏完淳,69231,别云间
231,237,兽炉沉水烟，翠沼残花片。,394,张可久,72377,塞鸿秋·春情
232,238,关山万里不可越，谁能坐对芳菲月。,378,卢思道,48170,从军行
233,239,流水本自断人肠，坚冰旧来伤马骨。,378,卢思道,48170,从军行
234,240,长风萧萧渡水来，归雁连连映天没。,378,卢思道,48170,从军行
235,241,汴水流，泗水流，流到瓜州古渡头。吴山点点愁。,665,白居易,71052,长相思·汴水流
236,242,男儿何不带吴钩，收取关山五十州。,349,李贺,71327,南园十三首·其五
237,243,古人今人若流水，共看明月皆如此。,247,李白,8239,把酒问月·故人贾淳令予问之
238,244,匈奴草黄马正肥，金山西见烟尘飞，汉家大将西出师。,113,岑参,9323,走马川行奉送出师西征 / 走马川行奉送封大夫出师西征
239,245,满目山河空念远，落花风雨更伤春。,432,晏殊,48600,浣溪沙·一向年光有限身
240,246,活水源流随处满，东风花柳逐时新。,654,于谦,72147,观书
241,247,伯牙鼓琴，志在高山,0,,72489,伯牙绝弦
242,248,欸乃一声山水绿。回看天际下中流，岩上无心云相逐。,646,柳宗元,18336,渔翁
243,249,平林漠漠烟如织，寒山一带伤心碧。,247,李白,47069,菩萨蛮·平林漠漠烟如织
244,250,烟水茫茫，千里斜阳暮。山无数。乱红如雨。不记来时路。,125,秦观,50288,点绛唇·桃源
245,251,雪里温柔，水边明秀，不借春工力。,217,辛弃疾,57645,念奴娇·梅
246,252,斜阳独倚西楼。遥山恰对帘钩。,432,晏殊,48616,清平乐·红笺小字
247,253,山远近，路横斜，青旗沽酒有人家。,217,辛弃疾,57674,鹧鸪天·陌上柔桑破嫩芽
248,254,此身行作稽山土，犹吊遗踪一泫然。,272,陆游,69129,沈园二首
249,255,斜阳流水推篷坐，翠色随人欲上船。,274,纪昀,71039,富春至严陵山水甚佳
250,256,红树青山日欲斜，长郊草色绿无涯。,561,欧阳修,70924,丰乐亭游春·其三
251,257,五月天山雪，无花只有寒。,247,李白,71316,塞下曲六首·其一
252,258,白日登山望烽火，黄昏饮马傍交河。,671,李颀,6013,古从军行
253,259,借问江潮与海水，何似君情与妾心？,665,白居易,71053,浪淘沙·借问江潮与海水
254,260,山川萧条极边土，胡骑凭陵杂风雨。,227,高适,10240,燕歌行
255,261,平芜尽处是春山，行人更在春山外。,561,欧阳修,48741,踏莎行·候馆梅残
256,262,山边幽谷水边村，曾被疏花断客魂。,57,张嵲,71267,墨梅
257,263,犬吠水声中，桃花带露浓。,247,李白,8413,访戴天山道士不遇
258,265,却下水晶帘，玲珑望秋月。,247,李白,7783,玉阶怨
259,266,深知身在情长在，怅望江头江水声。,204,李商隐,28906,暮秋独游曲江
260,267,莫莫高山。深谷逶迤。,0,,47934,紫芝歌
261,269,两水夹明镜，双桥落彩虹。,247,李白,8292,秋登宣城谢脁北楼
262,270,渐行渐远渐无书，水阔鱼沉何处问。,561,欧阳修,48798,玉楼春·别后不知君远近
263,271,自笑堂堂汉使，得似洋洋河水，依旧只流东。,244,陈亮,58914,水调歌头·送章德茂大卿使虏
264,272,群山万壑赴荆门，生长明妃尚有村。,474,杜甫,70859,咏怀古迹五首·其三
265,273,江流天地外，山色有无中。,515,王维,5649,汉江临泛 / 汉江临眺
266,274,报道山中去，归时每日斜。,392,皎然,43298,寻陆鸿渐不遇
267,275,碧野朱桥当日事，人不见，水空流。,125,秦观,50238,江城子·西城杨柳弄春柔
268,276,太乙近天都，连山接海隅。,515,王维,5642,终南山
269,277,海畔尖山似剑铓，秋来处处割愁肠。,646,柳宗元,18225,与浩初上人同看山寄京华亲故
270,278,水调数声持酒听。午醉醒来愁未醒。,587,张先,48495,天仙子·水调数声持酒听
271,279,筑室兮水中，葺之兮荷盖；,238,屈原,71262,九歌·湘夫人
272,280,吴姬越艳楚王妃，争弄莲舟水湿衣。,437,王昌龄,6434,采莲曲二首
273,281,凉月如眉挂柳湾，越中山色镜中看。,286,戴叔伦,14364,兰溪棹歌
274,283,河水倾泼丈余，鸡鸣犬吠满城中。,567,蒲松龄,72498,地震
275,284,栖霞山裂；沂水陷穴，广数亩。,567,蒲松龄,72498,地震
276,285,鼎湖流水清且闲，轩辕去时有弓剑，古人传道留其间。,247,李白,7724,飞龙引二首·其二
277,286,白酒新熟山中归，黄鸡啄黍秋正肥。,247,李白,8092,南陵别儿童入京
278,287,四月清和雨乍晴，南山当户转分明。,568,司马光,71229,客中初夏
279,288,隋堤三月水溶溶。背归鸿，去吴中。,183,苏轼,49476,江神子·恨别
280,289,惟有楼前流水，应念我、终日凝眸。,536,李清照,52801,凤凰台上忆吹箫·香冷金猊
281,290,知章骑马似乘船，眼花落井水底眠。,474,杜甫,10394,饮中八仙歌
282,291,淮水东边旧时月，夜深还过女墙来。,197,刘禹锡,19002,金陵五题·石头城
283,292,远去不逢青海马，力穷难拔蜀山蛇。,204,李商隐,28669,咏史二首·其二
284,293,一枝红艳露凝香，云雨巫山枉断肠。,247,李白,70872,清平调·其二
