id,juId,content,poetId,poetName,poetryId,poetryName
1371,1406,伏雨朝寒愁不胜，那能还傍杏花行。,188,纳兰性德,71438,浣溪沙·伏雨朝寒愁不胜
1372,1407,门隔花深旧梦游，夕阳无语燕归愁。玉纤香动小帘钩。,670,吴文英,72029,浣溪沙·门隔花深旧梦游
1373,1408,一场愁梦酒醒时，斜阳却照深深院。,432,晏殊,48665,踏莎行·小径红稀
1374,1409,东风有信无人见，露微意、柳际花边。,183,苏轼,49398,一丛花·初春病起
1375,1410,遗民忍死望恢复，几处今宵垂泪痕。,272,陆游,71867,关山月
1376,1411,荷花娇欲语，愁杀荡舟人。,247,李白,7817,渌水曲
1377,1412,长驱入，歌台舞榭，风卷落花愁。,330,徐君宝妻,68636,满庭芳·汉上繁华
1378,1413,独抱浓愁无好梦，夜阑犹剪灯花弄。,536,李清照,52804,蝶恋花·暖雨晴风初破冻
1379,1414,雨歇梧桐泪乍收，遣怀翻自忆从头。,188,纳兰性德,71462,浣溪沙·雨歇梧桐泪乍收
1380,1415,无人知此意，歌罢满帘风。,724,陈与义,53471,临江仙·高咏楚词酬午日
1381,1416,谁谓伤心画不成，画人心逐世人情。,622,韦庄,38365,金陵图
1382,1417,枝上流莺和泪闻，新啼痕间旧啼痕。,125,秦观,71190,鹧鸪天·枝上流莺和泪闻
1383,1418,土花曾染湘娥黛，铅泪难消。,188,纳兰性德,71708,采桑子·土花曾染湘娥黛
1384,1419,月去疏帘才数尺，乌鹊惊飞，一片伤心白。,207,宋琬,70710,蝶恋花·旅月怀人
1385,1420,总是愁媒，欲诉谁消遣。,183,苏轼,49673,蝶恋花·蝶懒莺慵春过半
1386,1421,谁谓含愁独不见，更教明月照流黄。,494,沈佺期,4745,古意呈补阙乔知之 / 独不见
1387,1422,红莲相倚浑如醉，白鸟无言定自愁。,217,辛弃疾,57569,鹧鸪天·鹅湖归病起作
1388,1423,今年对花最匆匆，相逢似有恨，依依愁悴。,164,周邦彦,51009,花犯·小石梅花
1389,1424,愁因薄暮起，兴是清秋发。,757,孟浩然,7247,秋登兰山寄张五 / 九月九日岘山寄张子容
1390,1425,留连光景惜朱颜，黄昏独倚阑。,269,李煜,47047,阮郎归·呈郑王十二弟
1391,1426,不及夜台尘土隔，冷清清、一片埋愁地。,188,纳兰性德,72156,金缕曲·亡妇忌日有感
1392,1428,困倚危楼。过尽飞鸿字字愁。,125,秦观,50245,减字木兰花·天涯旧恨
1393,1429,横笛和愁听，斜枝倚病看。,31,崔道融,39390,梅花
1394,1430,庭户无人秋月明，夜霜欲落气先清。,179,张耒,70947,夜坐
1395,1431,双燕飞来，陌上相逢否？撩乱春愁如柳絮。,186,冯延巳,48188,鹊踏枝·几日行云何处去
1396,1432,佳节久从愁里过，壮心偶傍醉中来。,554,苏洵,71850,九日和韩魏公
1397,1433,倚遍阑干，只是无情绪。,536,李清照,52822,点绛唇·闺思
1398,1434,从来幽怨应无数？铁马金戈，青冢黄昏路。,188,纳兰性德,71687,蝶恋花·出塞
1399,1435,永怀愁不寐，松月夜窗虚。,757,孟浩然,7413,岁暮归南山 / 归故园作 / 归终南山
1400,1436,身外闲愁空满，眼中欢事常稀。,588,晏几道,49114,临江仙·身外闲愁空满
1401,1437,枫树夜猿愁自断，女萝山鬼语相邀。,204,李商隐,28813,楚宫
1402,1438,恋树湿花飞不起，愁无比，和春付与东流水。,562,朱服,65426,渔家傲·小雨纤纤风细细
1403,1439,我当二十不得意，一心愁谢如枯兰。,349,李贺,20420,开愁歌
1404,1440,当关不报侵晨客，新得佳人字莫愁。,204,李商隐,28753,富平少侯
1405,1441,分明一觉华胥梦，回首东风泪满衣。,632,赵鼎,52927,鹧鸪天·建康上元作
1406,1442,伤心枕上三更雨，点滴霖霪。,536,李清照,52813,添字丑奴儿·窗前谁种芭蕉树
1407,1443,林卧愁春尽，开轩览物华。,757,孟浩然,7370,清明日宴梅道士房
1408,1444,玉惨花愁出凤城，莲花楼下柳青青。,427,聂胜琼,71953,鹧鸪天·别情
1409,1445,万事一身伤老矣，戎葵凝笑墙东。,724,陈与义,53471,临江仙·高咏楚词酬午日
1410,1446,是他春带愁来，春归何处。,217,辛弃疾,57589,祝英台近·晚春
1411,1447,伤心莫问前朝事，重上越王台。,692,倪瓒,70133,人月圆·伤心莫问前朝事
1412,1448,贾生年少虚垂泪，王粲春来更远游。,204,李商隐,29049,安定城楼
1413,1449,数回细写愁仍破，万颗匀圆讶许同。,474,杜甫,11008,野人送朱樱
1414,1450,年年负却花期！过春时，只合安排愁绪送春归。,449,张惠言,70785,相见欢·年年负却花期
1415,1451,绿杨芳草几时休，泪眼愁肠先已断。,607,钱惟演,65057,木兰花·城上风光莺语乱
1416,1452,曲港跳鱼，圆荷泻露，寂寞无人见。,183,苏轼,49493,永遇乐·彭城夜宿燕子楼
1417,1453,晓风不散愁千点，宿雨还添泪一痕。,611,曹雪芹,71414,咏白海棠
1418,1454,惜别伤离方寸乱。忘了临行，酒盏深和浅。,536,李清照,52803,蝶恋花·泪湿罗衣脂粉满
1419,1455,自春来、惨绿愁红，芳心是事可可。,535,柳永,48292,定风波·自春来
1420,1458,平生不下泪，于此泣无穷。,247,李白,8095,江夏别宋之悌
1421,1459,心断新丰酒，销愁斗几千。,204,李商隐,28626,风雨
1422,1460,楼儿忒小不藏愁。几度和云飞去、觅归舟。,442,蒋捷,64104,虞美人·梳楼
1423,1461,多少泪珠何限恨，倚栏干。,332,李璟,71073,摊破浣溪沙·菡萏香销翠叶残
1424,1462,远信入门先有泪，妻惊女哭问何如。,18,元稹,20973,得乐天书
1425,1463,吾闻马周昔作新丰客，天荒地老无人识。,349,李贺,20378,致酒行
1426,1464,桂叶双眉久不描，残妆和泪污红绡。,900,江采萍,566,谢赐珍珠
1427,1465,赤壁矶头落照，肥水桥边衰草，渺渺唤人愁。,406,张孝祥,56549,水调歌头·和庞佑父
1428,1466,已诉征求贫到骨，正思戎马泪盈巾。,474,杜甫,11457,又呈吴郎
1429,1467,低花树映小妆楼，春入眉心两点愁。,665,白居易,22979,春词
1430,1468,念畴昔风流，暗伤如许。,312,柳如是,71570,金明池·咏寒柳
1431,1469,午梦初回，卷帘尽放春愁去。,215,周晋,67095,点绛唇·访牟存叟南漪钓隐
1432,1470,紫黯红愁无绪，日暮春归甚处？,88,龚自珍,72087,如梦令·紫黯红愁无绪
1433,1471,昨风一吹无人会，今夜清光似往年。,665,白居易,22192,八月十五日夜湓亭望月
1434,1472,枕上潜垂泪，花间暗断肠。,114,鱼玄机,42920,赠邻女 / 寄李亿员外
1435,1473,离愁正引千丝乱，更东陌、飞絮濛濛。,587,张先,48441,一丛花令·伤高怀远几时穷
1436,1474,萧条庭院，又斜风细雨，重门须闭。,536,李清照,52815,念奴娇·春情
1437,1475,新欢不抵旧愁多，倒添了、新愁归去。,529,范成大,56208,鹊桥仙·七夕
1438,1476,都道无人愁似我，今夜雪，有梅花，似我愁。,442,蒋捷,71485,梅花引·荆溪阻雪
1439,1477,把酒送春春不语。黄昏却下潇潇雨。,220,朱淑真,55203,蝶恋花·送春
1440,1479,愁颜与衰鬓，明日又逢春。,286,戴叔伦,14180,除夜宿石头驿
1441,1480,帘控钩，掩上珠楼，风雨替花愁。,37,乔吉,71971,春闺怨·不系雕鞍门前柳
1442,1481,寒山吹笛唤春归，迁客相看泪满衣。,484,李益,14997,春夜闻笛
1443,1482,才过清明，渐觉伤春暮。,579,李冠,65087,蝶恋花·春暮
1444,1483,无处不伤心，轻尘在玉琴。,188,纳兰性德,71454,菩萨蛮·萧萧几叶风兼雨
1445,1484,谪仙何处，无人伴我白螺杯。,268,黄庭坚,49868,水调歌头·游览
1446,1485,残月脸边明，别泪临清晓。,594,牛希济,47197,生查子·春山烟欲收
1447,1486,人老去西风白发，蝶愁来明日黄花。,394,张可久,71845,折桂令·九日
1448,1487,芳菲歇。故园目断伤心切。,412,向子諲,52988,秦楼月·芳菲歇
1449,1488,近泪无干土，低空有断云。,474,杜甫,11140,别房太尉墓
1450,1489,铜盘烛泪已流尽，霏霏凉露沾衣。,164,周邦彦,51051,夜飞鹊·河桥送人处
1451,1490,忍泪佯低面，含羞半敛眉。,622,韦庄,71060,女冠子·四月十七
1452,1491,柳色参差掩画楼，晓莺啼送满宫愁。,525,司马扎,47488,宫怨 / 闺怨
1453,1492,但梦想、一枝潇洒，黄昏斜照水。,164,周邦彦,51009,花犯·小石梅花
1454,1493,不忍覆余觞，临风泪数行。,188,纳兰性德,70760,菩萨蛮·催花未歇花奴鼓
1455,1494,山暝闻猿愁，沧江急夜流。,757,孟浩然,7325,宿桐庐江寄广陵旧游
1456,1495,三千丈清愁鬓发，五十年春梦繁华。,37,乔吉,71799,折桂令·客窗清明
1457,1496,失意还独语，多愁只自知。,390,张籍,19844,蓟北旅思 / 送远人
1458,1497,天与秋光，转转情伤，探金英知近重阳。,536,李清照,71346,行香子·天与秋光
1459,1498,幽径无人独自芳，此恨凭谁诉。,537,曹组,52178,卜算子·兰
1460,1499,黄昏鼓角似边州，三十年前上此楼。,484,李益,15004,上汝州郡楼
1461,1500,叹凤嗟身否，伤麟怨道穷。,520,李隆基,425,经邹鲁祭孔子而叹之
1462,1501,夜寒惊被薄，泪与灯花落。,188,纳兰性德,71454,菩萨蛮·萧萧几叶风兼雨
1463,1502,不愁屋漏床床湿，且喜溪流岸岸深。,142,曾几,70958,苏秀道中
1464,1503,掩泪空相向，风尘何处期。,583,卢纶,14710,李端公 / 送李端
1465,1504,巫峡啼猿数行泪，衡阳归雁几封书。,227,高适,10310,送李少府贬峡中王少府贬长沙
1466,1505,曾苦伤春不忍听，凤城何处有花枝。,204,李商隐,29076,流莺
1467,1506,如今风雨西楼夜，不听清歌也泪垂。,87,周紫芝,52549,鹧鸪天·一点残红欲尽时
1468,1507,浊酒不销忧国泪，救时应仗出群才。,381,秋瑾,69431,黄海舟中日人索句并见日俄战争地图
1469,1508,零泪向谁道，鸡鸣徒叹息。,628,沈约,70908,夜夜曲
1470,1509,被冷香消新梦觉，不许愁人不起。,536,李清照,52815,念奴娇·春情
1471,1510,萧条亭障远，凄惨风尘多。,662,庾信,71648,拟咏怀二十七首·其二十六
1472,1512,风雨牢愁无著处，那更寒蛩四壁。,173,文天祥,68386,酹江月·和友驿中言别
1473,1513,跨马出郊时极目，不堪人事日萧条。,474,杜甫,11038,野望
1474,1514,泪弹不尽临窗滴。就砚旋研墨。,588,晏几道,49346,思远人·红叶黄花秋意晚
1475,1515,霜殒芦花泪湿衣，白头无复倚柴扉。,0,,71982,思母
1476,1516,天际两蛾凝黛，愁与恨、几时极。,483,韩元吉,55113,霜天晓角·题采石蛾眉亭
1477,1517,念兰堂红烛，心长焰短，向人垂泪。,432,晏殊,48631,撼庭秋·别来音信千里
1478,1518,宿醉离愁慢髻鬟，六铢衣薄惹轻寒，慵红闷翠掩青鸾。,130,韩偓,58671,浣溪沙·宿醉离愁慢髻鬟
1479,1519,燕语如伤旧国春，宫花一落已成尘。,484,李益,15002,隋宫燕
1480,1520,客里相逢，篱角黄昏，无言自倚修竹。,30,姜夔,71276,暗香疏影
1481,1521,无人解，树转午阴凉。,658,舒頔,71818,小重山·端午
1482,1522,一曲当筵落泪，重掩罗巾。,432,晏殊,48704,山亭柳·赠歌者
1483,1523,泪眼倚楼频独语。双燕飞来，陌上相逢否？,186,冯延巳,48188,鹊踏枝·几日行云何处去
1484,1525,灞桥杨柳年年恨，鸳浦芙蓉叶叶愁。,467,苏庠,51414,鹧鸪天·枫落河梁野水秋
1485,1526,昨夜笙歌容易散，酒醒添得愁无限。,186,冯延巳,71719,鹊踏枝·梅落繁枝千万片
1486,1527,愁无限，消瘦尽，有谁知？闲教玉笼鹦鹉念郎诗。,188,纳兰性德,70766,相见欢·落花如梦凄迷
1487,1528,醉中浑不记，归路月黄昏。,217,辛弃疾,57576,临江仙·探梅
1488,1529,关河无限清愁，不堪临鉴。,294,岳珂,66897,祝英台近·北固亭
1489,1530,恼乱横波秋一寸。斜阳只与黄昏近。,11,赵令畤,49121,蝶恋花·卷絮风头寒欲尽
1490,1531,佳期怅何许，泪下如流霰。,32,谢朓,48107,晚登三山还望京邑
1491,1532,寄语天涯客，轻寒底用愁。,654,于谦,69199,除夜太原寒甚
1492,1533,弟妹萧条各何在，干戈衰谢两相催！,474,杜甫,71837,九日五首·其一
1493,1534,不剪春衫愁意态。过收灯、有些寒在。,729,史达祖,59818,夜行船·正月十八日闻卖杏花有感
1494,1535,桐花半亩，静锁一庭愁雨。,164,周邦彦,50934,琐窗寒·寒食
1495,1536,短梦依然江表，老泪洒西州。,53,张炎,64154,八声甘州·记玉关踏雪事清游
1496,1537,蜂儿不解知人苦，燕儿不解说人愁。,486,程垓,58192,最高楼·旧时心事
1497,1538,今日山城对垂泪，伤心不独为悲秋。,484,李益,15004,上汝州郡楼
1498,1539,夜来携手梦同游，晨起盈巾泪莫收。,665,白居易,23751,梦微之
1499,1540,总把春山扫眉黛，不知供得几多愁？,204,李商隐,28778,代赠二首
1500,1541,疏星淡月秋千院，愁云恨雨芙蓉面。,394,张可久,72377,塞鸿秋·春情
1501,1542,去年东武今夕，明月不胜愁。,366,苏辙,65319,水调歌头·徐州中秋
1502,1543,谁见汀洲上，相思愁白蘋。,104,刘长卿,6771,饯别王十一南游
1503,1544,断肠片片飞红，都无人管，倩谁唤、流莺声住。,217,辛弃疾,57589,祝英台近·晚春
1504,1545,情似游丝，人如飞絮。泪珠阁定空相觑。,87,周紫芝,52635,踏莎行·情似游丝
1505,1546,数州消息断，愁坐正书空。,474,杜甫,10831,对雪
1506,1547,不知何日始工愁。记取那回花下一低头。,408,王国维,71722,虞美人·弄梅骑竹嬉游日
1507,1548,恨萧萧、无情风雨，夜来揉损琼肌。,536,李清照,52795,多丽·咏白菊
1508,1549,独倚画栏如有意，清砧怨笛送黄昏。,611,曹雪芹,71414,咏白海棠
1509,1550,坠粉飘香，日日唤愁生。,538,卢祖皋,60415,江城子·画楼帘幕卷新晴
1510,1551,祁祁伤豳歌，萋萋感楚吟。,758,谢灵运,48082,登池上楼
1511,1552,永丰柳，无人尽日飞花雪。,587,张先,48510,千秋岁·数声鶗鴂
1512,1553,忽然更作渔阳掺，黄云萧条白日暗。,671,李颀,6033,听安万善吹觱篥歌
1513,1554,推手遽止之，湿衣泪滂滂。,682,韩愈,17758,听颖师弹琴
1514,1555,愁一箭风快，半篙波暖，回头迢递便数驿。,164,周邦彦,51015,兰陵王·柳
1515,1556,四百年来成一梦，堪愁。,405,王安石,49087,南乡子·自古帝王州
1516,1557,赠远虚盈手，伤离适断肠。,204,李商隐,28732,十一月中旬至扶风界见梅花
1517,1558,燕子归来愁不语。旧巢无觅处。,201,李好古,61441,谒金门·花过雨
1518,1559,不枉东风吹客泪。相思难表，梦魂无据，惟有归来是。,561,欧阳修,71372,青玉案·一年春事都来几
1519,1560,天上人间何处去，旧欢新梦觉来时，黄昏微雨画帘垂。,29,张曙,47125,浣溪沙·枕障薰炉隔绣帷
1520,1561,长记海棠开后，正伤春时节。,536,李清照,52858,好事近·风定落花深
1521,1562,知君惯度祁连城，岂能愁见轮台月。,113,岑参,9330,送李副使赴碛西官军
1522,1563,愁云淡淡雨潇潇。暮暮复朝朝。,574,石孝友,58578,眼儿媚·愁云淡淡雨潇潇
1523,1564,今宵绝胜无人共，卧看星河尽意明。,724,陈与义,69122,雨晴
1524,1565,絮影苹香，春在无人处。,215,周晋,67095,点绛唇·访牟存叟南漪钓隐
1525,1566,尽做旧愁都忘却，新愁何处着？,414,王庭筠,71225,谒金门·双喜鹊
1526,1567,向露冷风清，无人处，耿耿寒漏咽。,164,周邦彦,50948,浪淘沙慢·晓阴重
1527,1568,须愁春漏短，莫诉金杯满。,622,韦庄,71059,菩萨蛮·劝君今夜须沉醉
1528,1569,谁道投鞭飞渡，忆昔鸣髇血污，风雨佛狸愁。,217,辛弃疾,57538,水调歌头·舟次扬州和人韵
1529,1571,昨夜更阑酒醒，春愁过却病。,332,李璟,47049,应天长·一钩初月临妆镜
1530,1572,香帏风动花入楼，高调鸣筝缓夜愁。,437,王昌龄,6441,青楼怨
1531,1573,半死梧桐老病身，重泉一念一伤神。,665,白居易,21833,为薛台悼亡
1532,1574,黄昏院落，凄凄惶惶，酒醒时往事愁肠。,536,李清照,71346,行香子·天与秋光
1533,1575,终然独不见，流泪空自知。,247,李白,7768,独不见
1534,1576,立尽黄昏泪几行，一片鸦啼月。,526,夏完淳,70706,卜算子·秋色到空闺
1535,1577,明月，明月，胡笳一声愁绝。,286,戴叔伦,47080,调笑令·边草
1536,1578,尊前只恐伤郎意，阁泪汪汪不敢垂。,168,夏竦,65072,鹧鸪天·镇日无心扫黛眉
1537,1579,唤起两眸清炯炯。泪花落枕红棉冷。,164,周邦彦,51033,蝶恋花·早行
1538,1580,君看石芒砀，掩泪悲千古。,247,李白,1491,丁督护歌
1539,1581,望章台路杳，金鞍游荡，有盈盈泪。,245,章楶,65200,水龙吟·燕忙莺懒芳残
1540,1582,梯横画阁黄昏后，又还是、斜月帘栊。,587,张先,48441,一丛花令·伤高怀远几时穷
1541,1583,好去不须频下泪，老僧相伴有烟霞。,212,金地藏,43025,送童子下山
1542,1584,万里伤心严谴日，百年垂死中兴时。,474,杜甫,10865,送郑十八虔贬台州司户伤其临老陷贼之故阙为面别情见于诗
1543,1585,低头独长叹，此叹无人喻。,665,白居易,21237,买花 / 牡丹
1544,1586,但恨处非位，怆悢使心伤。,698,阮籍,71638,咏怀八十二首·其七十九
1545,1587,客里看春多草草，总被诗愁分了。,53,张炎,64382,清平乐·采芳人杳
1546,1588,衰柳寒蝉一片愁，谁肯教白衣送酒？,191,卢挚,71349,沉醉东风·重九
1547,1589,天上星河转，人间帘幕垂。凉生枕簟泪痕滋。,536,李清照,52790,南歌子·天上星河转
1548,1590,才道莫伤神，青衫湿一痕。,188,纳兰性德,71468,菩萨蛮·新寒中酒敲窗雨
1549,1591,却忆安石风流，东山岁晚，泪落哀筝曲。,217,辛弃疾,57544,念奴娇·登建康赏心亭呈史致道留守
1550,1592,独上小搂春欲暮，愁望玉关芳草路。,622,韦庄,71375,木兰花·独上小楼春欲暮
1551,1593,翠蛾轻敛意沉吟，沾襟，无人知此心。,455,孙光宪,71700,河传·花落
1552,1594,深宫桃李无人问，旧爱玉颜今自恨。,600,元好问,71511,玉楼春·惊沙猎猎风成阵
1553,1595,砧面莹，杵声齐。捣就征衣泪墨题。,399,贺铸,50447,杵声齐·砧面莹
1554,1596,岁华向晚愁思，谁念玉关人老？,300,蔡挺,71393,喜迁莺·霜天秋晓
1555,1597,寒禽与衰草，处处伴愁颜。,750,司空曙,15468,贼平后送人北归
1556,1598,不语含嚬深浦里，几回愁煞棹船郎，燕归帆尽水茫茫。,342,薛昭蕴,71063,浣溪沙·红蓼渡头秋正雨
1557,1599,断肠何必更残阳，极目伤平楚。,141,廖世美,64708,烛影摇红·题安陆浮云楼
1558,1600,草木虽无情，因依尚可生。,247,李白,7804,树中草
1559,1601,江亭暇日堪高会，醉讽离骚不解愁。,716,边贡,71343,午日观竞渡
1560,1602,形影忽不见，翩翩伤我心。,322,曹植,71501,杂诗七首·其一
1561,1603,酒醒人静奈愁浓。残灯孤枕梦，轻浪五更风。,19,徐昌图,47419,临江仙·饮散离亭西去
1562,1604,催成清泪，惊残孤梦，又拣深枝飞去。,272,陆游,56079,鹊桥仙·夜闻杜鹃
1563,1605,孤芳一世，供断有情愁，消瘦损，东阳也，试问花知否？,537,曹组,71087,蓦山溪·梅
1564,1606,无言暗将红泪弹。阑珊，香销轻梦还。,188,纳兰性德,70764,河传·春浅
1565,1607,便做无情，莫也愁人苦。,220,朱淑真,55203,蝶恋花·送春
1566,1608,去意徊徨，别语愁难听。,164,周邦彦,51033,蝶恋花·早行
1567,1609,不道愁人不喜听。空阶滴到明。,40,万俟咏,64634,长相思·雨
1568,1610,杜诗韩笔愁来读，似倩麻姑痒处搔。,211,杜牧,27579,读韩杜集
1569,1611,伤情燕足留红线，恼人鸾影闲团扇。,394,张可久,72377,塞鸿秋·春情
1570,1612,忙日苦多闲日少，新愁常续旧愁生。,272,陆游,55981,浣溪沙·和无咎韵
1571,1613,万顷风涛不记苏。雪晴江上麦千车。但令人饱我愁无。,183,苏轼,49579,浣溪沙·万顷风涛不记苏
1572,1614,一任紫玉无情，夜寒吹裂。,188,纳兰性德,71832,琵琶仙·中秋
1573,1615,绿鬓能供多少恨，未肯无情比断弦。,588,晏几道,49285,破阵子·柳下笙歌庭院
1574,1616,争奈愁来，一日却为长。,399,贺铸,50488,行路难·缚虎手
1575,1617,握手一长叹，泪为生别滋。,460,苏武,71945,留别妻
1576,1618,却愁宴罢青娥散，扬子江头月半斜。,622,韦庄,38369,陪金陵府相中堂夜宴
1577,1619,叹息此人去，萧条徐泗空。,247,李白,8362,经下邳圯桥怀张子房
1578,1620,隐约遥峰，和泪谢娘眉妩。,729,史达祖,59814,绮罗香·咏春雨
1579,1621,白发书生神州泪，尽凄凉、不向牛山滴。,106,刘克庄,61142,贺新郎·九日
1580,1622,幅巾藜杖北城头，卷地西风满眼愁。,272,陆游,71409,秋晚登城北楼
1581,1623,无人收废帐，归马识残旗。,390,张籍,19954,没蕃故人
1582,1624,教人怎不伤情。觉几度、魂飞梦惊。,52,刘过,59142,柳梢青·送卢梅坡
1583,1625,无限伤心夕照中，故国凄凉，剩粉余红。,526,夏完淳,72112,一剪梅·咏柳
1584,1626,卷尽愁云，素娥临夜新梳洗。,670,吴文英,62284,点绛唇·试灯夜初晴
1585,1627,欲共柳花低诉，怕柳花轻薄，不解伤春。,558,黄孝迈,67089,湘春夜月·近清明
1586,1628,瞻彼洛城郭，微子为哀伤。,552,曹操,72434,薤露
1587,1629,千里万里，二月三月，行色苦愁人。,561,欧阳修,48955,少年游·栏干十二独凭春
1588,1630,伤心庾开府，老作北朝臣。,750,司空曙,15496,金陵怀古
1589,1631,沧海客归珠有泪，章台人去骨遗香。,596,宋祁,69067,落花
1590,1633,人散市声收，渐入愁时节。,106,刘克庄,61084,生查子·元夕戏陈敬叟
1591,1634,愁里高歌梁父吟，犹如金玉戛商音。,559,郑思肖,69148,二砺
1592,1635,云白山青万余里，愁看直北是长安。,474,杜甫,11593,小寒食舟中作
1593,1636,易得凋零，更多少无情风雨。,428,赵佶,72017,燕山亭·北行见杏花
1594,1637,江心云带蒲帆重，楼上风吹粉泪香。,663,严仁,66952,鹧鸪天·惜别
1595,1638,风淅淅，雨纤纤。难怪春愁细细添。,188,纳兰性德,71498,赤枣子·风淅淅
1596,1640,玉皇开碧落，银界失黄昏。,710,毛滂,51629,临江仙·都城元夕
1597,1641,无一语，对芳尊。安排肠断到黄昏。,125,秦观,71190,鹧鸪天·枝上流莺和泪闻
1598,1642,桃花洞，瑶台梦，一片春愁谁与共？,528,和凝,71634,天仙子·柳色披衫金缕凤
1599,1643,迢递路回清野，人语渐无闻，空带愁归。,164,周邦彦,51051,夜飞鹊·河桥送人处
1600,1644,有怅寒潮，无情残照，正是萧萧南浦。,312,柳如是,71570,金明池·咏寒柳
1601,1645,泪滴千千万万行，更使人、愁肠断。,462,乐婉,64874,卜算子·答施
1602,1646,麦浪翻晴风飐柳，已过伤春候。,188,纳兰性德,71513,四和香·麦浪翻晴风飐柳
1603,1647,扰扰马足车尘，被岁月无情，暗消年少。,600,元好问,72037,玉漏迟·咏杯
1604,1648,佳辰强饮食犹寒，隐几萧条戴鹖冠。,474,杜甫,11593,小寒食舟中作
1605,1649,微晕娇花湿欲流，簟纹灯影一生愁。,188,纳兰性德,71612,浣溪沙·咏五更和湘真韵
1606,1650,柳叶随歌皱，梨花与泪倾。,268,黄庭坚,50020,南歌子·槐绿低窗暗
1607,1651,仗酒祓清愁，花销英气。,30,姜夔,59374,翠楼吟·淳熙丙午冬
1608,1652,待约个梅魂，黄昏月淡，与伊深怜低语。,312,柳如是,71570,金明池·咏寒柳
1609,1653,暗教愁损兰成，可怜夜夜关情。,53,张炎,64278,清平乐·候蛩凄断
1610,1654,春去秋来也，愁心似醉醺。,175,欧阳炯,71378,巫山一段云·春去秋来也
1611,1655,花不语，水空流。年年拚得为花愁。,588,晏几道,49139,鹧鸪天·守得莲开结伴游
1612,1656,如今但暮雨，蜂愁蝶恨，小窗闲对芭蕉展。,241,吕渭老,53732,薄幸·青楼春晚
1613,1657,午窗睡起莺声巧，何处唤春愁？,220,朱淑真,55199,眼儿媚·迟迟春日弄轻柔
1614,1658,可堪更近乾龙节。眼中泪尽空啼血。,412,向子諲,52988,秦楼月·芳菲歇
1615,1659,近来何处有吾愁，何处还知吾乐。,217,辛弃疾,57547,念奴娇·赋雨岩
1616,1660,杏花无处避春愁，也傍野烟发。,483,韩元吉,55179,好事近·汴京赐宴闻教坊乐有感
1617,1661,寻河愁地尽，过碛觉天低。,113,岑参,9381,碛西头送李判官入京
1618,1662,粉黛暗愁金带枕，鸳鸯空绕画罗衣，那堪辜负不思归！,496,顾敻,71507,浣溪沙·云淡风高叶乱飞
1619,1663,淮水悠悠。万顷烟波万顷愁。,2918,淮上女,67087,减字木兰花·淮山隐隐
1620,1664,阑干风冷雪漫漫，惆怅无人把钓竿。,30,姜夔,71476,钓雪亭
1621,1665,翠葆参差竹径成。新荷跳雨泪珠倾。曲阑斜转小池亭。,164,周邦彦,50975,浣沙溪·翠葆参差竹径成
1622,1666,眉尖早识愁滋味，娇羞未解论心事。,439,黄公度,54800,菩萨蛮·眉尖早识愁滋味
1623,1667,自笑好山如好色，只今怀树更怀人。闲愁闲恨一番新。,217,辛弃疾,57835,浣溪沙·偕叔高子似宿山寺戏作
1624,1668,愁损翠黛双蛾，日日画阑独凭。,729,史达祖,59815,双双燕·咏燕
1625,1669,几日喜春晴，几夜愁春雨。,287,高观国,60006,卜算子·泛西湖坐间寅斋同赋
1626,1670,念归林叶换，愁坐露华生。,691,张九龄,2845,西江夜行
1627,1671,丹桂不知摇落恨，素娥应信别离愁。,228,王琪,65123,望江南·江南月
1628,1672,明妃留在两眉愁，万古春山颦不尽。,600,元好问,71511,玉楼春·惊沙猎猎风成阵
1629,1673,伤心千古，秦淮一片明月！,545,萨都剌,72111,念奴娇·登石头城次东坡韵
1630,1674,胡人吹笛戍楼间，楼上萧条海月闲。,227,高适,10347,和王七玉门关听吹笛 / 塞上闻笛
